address,lat,lng,raw_query,provider
東京都板橋区四葉2-6--3,35.77996826171875,139.65151977539062,東京都板橋区四葉2-6--3,jageocoder
大阪府枚方市伊加賀南町2-50,34.80916213989258,135.638916015625,大阪府枚方市伊加賀南町2-50,jageocoder
大阪府枚方市茄子作5-988-,34.77909851074219,135.66424560546875,大阪府枚方市茄子作5-988-,jageocoder
大阪府枚方市長尾元町5-10-15,34.82373809814453,135.7103729248047,大阪府枚方市長尾元町5-10-15,jageocoder
大阪府枚方市高野道1-23-10(ス-パ-万代横),34.84565734863281,135.69993591308594,大阪府枚方市高野道1-23-10(ス-パ-万代横),jageocoder
新潟県柏崎市東柳田30-,37.37886047363281,138.58108520507812,新潟県柏崎市東柳田30-,jageocoder
栃木県栃木市箱森町11-3,36.38578796386719,139.71768188476562,栃木県栃木市箱森町11-3,jageocoder
宮城県栗原市築館宮野中央一-4-5,38.746337890625,141.0159149169922,宮城県栗原市築館宮野中央一-4-5,jageocoder
群馬県桐生市相生町5-字北縁480-1,36.41512680053711,139.28726196289062,群馬県桐生市相生町5-字北縁480-1,jageocoder
奈良県桜井市大字大福1174-,34.521629333496094,135.82168579101562,奈良県桜井市大字大福1174-,jageocoder
神奈川県横浜市港南区日野中央3-19-12,35.377891540527344,139.58868408203125,神奈川県横浜市港南区日野中央3-19-12,jageocoder
神奈川県横浜市港南区日野六-11-1,35.393310546875,139.57635498046875,神奈川県横浜市港南区日野六-11-1,jageocoder
神奈川県横浜市緑区長津田みなみ台5-11-4,35.523258209228516,139.49874877929688,神奈川県横浜市緑区長津田みなみ台5-11-4,jageocoder
神奈川県横須賀市佐原三-21-1,35.23333740234375,139.678466796875,神奈川県横須賀市佐原三-21-1,jageocoder
奈良県橿原市木原町字奈良地238-1,34.517486572265625,135.80169677734375,奈良県橿原市木原町字奈良地238-1,jageocoder
大阪府大阪市此花区高見1-5 高見プラザ2階,34.69235610961914,135.458984375,大阪府大阪市此花区高見1-5 高見プラザ2階,jageocoder
福井県越前市日野美2-18-1,35.89942932128906,136.154052734375,福井県越前市日野美2-18-1,jageocoder
栃木県さくら市卯の里1-12-7,36.68418884277344,139.9580535888672,栃木県さくら市卯の里1-12-7,jageocoder
宮城県気仙沼市田中前1-6-3,38.89225769042969,141.56341552734375,宮城県気仙沼市田中前1-6-3,jageocoder
茨城県水戸市けやき台2-1-,36.33523178100586,140.48764038085938,茨城県水戸市けやき台2-1-,jageocoder
茨城県水戸市内原1-188,36.37405014038086,140.35528564453125,茨城県水戸市内原1-188,jageocoder
茨城県水戸市河和田2-1777-3,36.37675476074219,140.40725708007812,茨城県水戸市河和田2-1777-3,jageocoder
富山県氷見市柳田1945,36.8341178894043,136.99313354492188,富山県氷見市柳田1945,jageocoder
愛知県江南市赤童子町栄56-,35.32978439331055,136.8633270263672,愛知県江南市赤童子町栄56-,jageocoder
東京都江戸川区宇喜田町180-2,35.673431396484375,139.8614959716797,東京都江戸川区宇喜田町180-2,jageocoder
東京都江戸川区本一色1-28-3,35.71504592895508,139.869384765625,東京都江戸川区本一色1-28-3,jageocoder
東京都江戸川区鹿骨1-53-8,35.70890808105469,139.88980102539062,東京都江戸川区鹿骨1-53-8,jageocoder
沖縄県沖縄市美原3-18-15,26.34726905822754,127.81746673583984,沖縄県沖縄市美原3-18-15,jageocoder
静岡県沼津市北高島町8-6 フェスタノジマ内1階,35.111289978027344,138.85848999023438,静岡県沼津市北高島町8-6 フェスタノジマ内1階,jageocoder
群馬県沼田市上原町字白清水1605-6,36.64800262451172,139.06324768066406,群馬県沼田市上原町字白清水1605-6,jageocoder
大阪府泉佐野市日根野4619-1,34.39896774291992,135.32594299316406,大阪府泉佐野市日根野4619-1,jageocoder
大阪府泉大津市池浦町1-7-19,34.49814987182617,135.412353515625,大阪府泉大津市池浦町1-7-19,jageocoder
岡山県津山市志戸部684-1,35.076717376708984,134.01828002929688,岡山県津山市志戸部684-1,jageocoder
千葉県船橋市前原西2-19-1 津田沼ビ-ト5階,35.692283630371094,140.0220489501953,千葉県船橋市前原西2-19-1 津田沼ビ-ト5階,jageocoder
三重県津市藤方589-1,34.68346405029297,136.5149688720703,三重県津市藤方589-1,jageocoder
千葉県流山市野々下5-1065-1,35.861572265625,139.94540405273438,千葉県流山市野々下5-1065-1,jageocoder
東京都台東区浅草1-26-5,35.7126579284668,139.7932586669922,東京都台東区浅草1-26-5,jageocoder
静岡県浜松市中央区上島4-29-8,34.74418640136719,137.7464141845703,静岡県浜松市中央区上島4-29-8,jageocoder
静岡県浜松市中央区半田山3-31-23,34.77385330200195,137.74302673339844,静岡県浜松市中央区半田山3-31-23,jageocoder
静岡県浜松市中央区原島町497-1,34.7292366027832,137.7685089111328,静岡県浜松市中央区原島町497-1,jageocoder
静岡県浜松市中央区参野町58,34.69102096557617,137.75711059570312,静岡県浜松市中央区参野町58,jageocoder
静岡県浜松市中央区富塚町233-2,34.720054626464844,137.70591735839844,静岡県浜松市中央区富塚町233-2,jageocoder
静岡県浜松市中央区雄踏一-11-14,34.69544219970703,137.64633178710938,静岡県浜松市中央区雄踏一-11-14,jageocoder
静岡県浜松市中央区高丘東2-13-8,34.757083892822266,137.71084594726562,静岡県浜松市中央区高丘東2-13-8,jageocoder
埼玉県さいたま市浦和区東高砂町11-1 浦和パルコ3F,35.857906341552734,139.65863037109375,埼玉県さいたま市浦和区東高砂町11-1 浦和パルコ3F,jageocoder
埼玉県さいたま市岩槻区美園東一-5-12,35.8977165222168,139.7346649169922,埼玉県さいたま市岩槻区美園東一-5-12,jageocoder
和歌山県海南市重根74-1,34.155574798583984,135.2397003173828,和歌山県海南市重根74-1,jageocoder
大阪府大阪市淀川区新高二-2-8,34.729068756103516,135.47650146484375,大阪府大阪市淀川区新高二-2-8,jageocoder
埼玉県深谷市上野台3305-1,36.18635177612305,139.27133178710938,埼玉県深谷市上野台3305-1,jageocoder
静岡県静岡市清水区北脇258-1,35.01884460449219,138.4649200439453,静岡県静岡市清水区北脇258-1,jageocoder
群馬県渋川市行幸田91-1,36.480587005615234,139.00228881835938,群馬県渋川市行幸田91-1,jageocoder
静岡県湖西市鷲津3319(西遠皮膚科横),34.70982360839844,137.54025268554688,静岡県湖西市鷲津3319(西遠皮膚科横),jageocoder
神奈川県藤沢市遠藤字滝ノ沢698-10 湘南とうきゅうSC内2F,35.37135696411133,139.44212341308594,神奈川県藤沢市遠藤字滝ノ沢698-10 湘南とうきゅうSC内2F,jageocoder
北海道滝川市東町1-43-5,43.55412673950195,141.9253387451172,北海道滝川市東町1-43-5,jageocoder
岡山県瀬戸内市邑久町豊安18-1,34.663726806640625,134.09075927734375,岡山県瀬戸内市邑久町豊安18-1,jageocoder
愛知県瀬戸市小坂町235-,35.2023811340332,137.05154418945312,愛知県瀬戸市小坂町235-,jageocoder
静岡県焼津市小川字中川原道下3128-1,34.85051727294922,138.31842041015625,静岡県焼津市小川字中川原道下3128-1,jageocoder
熊本県合志市大字幾久富1909-1600,32.86566925048828,130.7713165283203,熊本県合志市大字幾久富1909-1600,jageocoder
熊本県菊池郡大津町室269-1,32.87529373168945,130.86793518066406,熊本県菊池郡大津町室269-1,jageocoder
熊本県熊本市南区野田2-29-23,32.73148727416992,130.6834716796875,熊本県熊本市南区野田2-29-23,jageocoder
熊本県宇城市松橋町きらら1-5-1,32.64577865600586,130.67843627929688,熊本県宇城市松橋町きらら1-5-1,jageocoder
熊本県熊本市北区武蔵ケ丘3-1-3,32.852508544921875,130.7665252685547,熊本県熊本市北区武蔵ケ丘3-1-3,jageocoder
熊本県熊本市南区江越1-17-7,32.77510452270508,130.70083618164062,熊本県熊本市南区江越1-17-7,jageocoder
熊本県熊本市北区高平3-36-22,32.84003448486328,130.71815490722656,熊本県熊本市北区高平3-36-22,jageocoder
熊本県熊本市東区花立4-3-5,32.78435134887695,130.77447509765625,熊本県熊本市東区花立4-3-5,jageocoder
熊本県熊本市東区長嶺南2-5-5,32.81093978881836,130.7686767578125,熊本県熊本市東区長嶺南2-5-5,jageocoder
埼玉県熊谷市円光2-1-12,36.15826416015625,139.38462829589844,埼玉県熊谷市円光2-1-12,jageocoder
新潟県燕市杣木2658-1,37.67180252075195,138.9099578857422,新潟県燕市杣木2658-1,jageocoder
茨城県牛久市上柏田3-67-1,35.989723205566406,140.1569061279297,茨城県牛久市上柏田3-67-1,jageocoder
千葉県印西市牧の原1-3-1 牧の原モア内,35.80453872680664,140.1664276123047,千葉県印西市牧の原1-3-1 牧の原モア内,jageocoder
静岡県牧之原市細江2153-1,34.75782775878906,138.24436950683594,静岡県牧之原市細江2153-1,jageocoder
熊本県玉名市岱明町庄山812,32.93582534790039,130.51824951171875,熊本県玉名市岱明町庄山812,jageocoder
岡山県玉野市宇野1-38-1 玉野メルカ2F,34.49262237548828,133.94517517089844,岡山県玉野市宇野1-38-1 玉野メルカ2F,jageocoder
岐阜県瑞浪市薬師町4-22-,35.363399505615234,137.2283935546875,岐阜県瑞浪市薬師町4-22-,jageocoder
大阪府東大阪市新町1-1,34.67076873779297,135.64041137695312,大阪府東大阪市新町1-1,jageocoder
福岡県朝倉市甘木一丁田324,33.41807174682617,130.66378784179688,福岡県朝倉市甘木一丁田324,jageocoder
愛知県あま市甚目寺五位田128,35.19685363769531,136.82472229003906,愛知県あま市甚目寺五位田128,jageocoder
奈良県生駒郡平群町大字下垣内78-1,34.62881851196289,135.7056121826172,奈良県生駒郡平群町大字下垣内78-1,jageocoder
福岡県田川市大字糒47-1,33.65668487548828,130.81480407714844,福岡県田川市大字糒47-1,jageocoder
大分県由布市挾間町大字北方46-3,33.20492935180664,131.52088928222656,大分県由布市挾間町大字北方46-3,jageocoder
山梨県甲州市塩山下塩後842-,35.69576644897461,138.71820068359375,山梨県甲州市塩山下塩後842-,jageocoder
山梨県甲府市中小河原一-12-26,35.634300231933594,138.56813049316406,山梨県甲府市中小河原一-12-26,jageocoder
山梨県中巨摩郡昭和町河西1074-4,35.61460876464844,138.51959228515625,山梨県中巨摩郡昭和町河西1074-4,jageocoder
山梨県甲斐市龍地3653-1,35.68291091918945,138.50619506835938,山梨県甲斐市龍地3653-1,jageocoder
東京都町田市小山ヶ丘5-1-1,35.60270690917969,139.3654022216797,東京都町田市小山ヶ丘5-1-1,jageocoder
宮城県登米市迫町佐沼字江合一-4-2,38.68556594848633,141.18682861328125,宮城県登米市迫町佐沼字江合一-4-2,jageocoder
福島県西白河郡西郷村字裏山南15,37.1253662109375,140.18272399902344,福島県西白河郡西郷村字裏山南15,jageocoder
島根県益田市中吉田町1084-5,34.6884651184082,131.84140014648438,島根県益田市中吉田町1084-5,jageocoder
岩手県盛岡市厨川3-13-30,39.74778366088867,141.13063049316406,岩手県盛岡市厨川3-13-30,jageocoder
岩手県盛岡市向中野2-5-8,39.68330764770508,141.14315795898438,岩手県盛岡市向中野2-5-8,jageocoder
岩手県盛岡市大館町19-18,39.71607971191406,141.1106719970703,岩手県盛岡市大館町19-18,jageocoder
神奈川県相模原市緑区向原一-16-27,35.59065246582031,139.3038787841797,神奈川県相模原市緑区向原一-16-27,jageocoder
神奈川県相模原市中央区東淵野辺4-23-15,35.55787658691406,139.41175842285156,神奈川県相模原市中央区東淵野辺4-23-15,jageocoder
神奈川県相模原市南区相武台三-26-35,35.504661560058594,139.4091339111328,神奈川県相模原市南区相武台三-26-35,jageocoder
神奈川県相模原市中央区相模原2-14-1,35.577842712402344,139.36793518066406,神奈川県相模原市中央区相模原2-14-1,jageocoder
栃木県真岡市大谷台町3-5,36.4376106262207,139.99594116210938,栃木県真岡市大谷台町3-5,jageocoder
栃木県矢板市中2013-4,36.80534362792969,139.94139099121094,栃木県矢板市中2013-4,jageocoder
沖縄県石垣市字真栄里549-1,24.33804702758789,124.17938232421875,沖縄県石垣市字真栄里549-1,jageocoder
宮城県石巻市大街道北1-5-25,38.430110931396484,141.28587341308594,宮城県石巻市大街道北1-5-25,jageocoder
富山県砺波市中神4-98,36.639610290527344,136.94496154785156,富山県砺波市中神4-98,jageocoder
愛知県碧南市音羽町4-73,34.87074661254883,136.98448181152344,愛知県碧南市音羽町4-73,jageocoder
静岡県磐田市鳥之瀬83,34.71293258666992,137.86404418945312,静岡県磐田市鳥之瀬83,jageocoder
兵庫県神戸市中央区東川崎町1-3-3 ハ-バ-ランドセンタ-ビル1階,34.676631927490234,135.1796875,兵庫県神戸市中央区東川崎町1-3-3 ハ-バ-ランドセンタ-ビル1階,jageocoder
兵庫県神戸市北区有野中町4-2-11,34.83372116088867,135.228515625,兵庫県神戸市北区有野中町4-2-11,jageocoder
福井県福井市大町1-505,36.03644561767578,136.2198944091797,福井県福井市大町1-505,jageocoder
福井県福井市若杉3-1709-,36.053096771240234,136.18853759765625,福井県福井市若杉3-1709-,jageocoder
福井県福井市高木中央2-3119,36.09263610839844,136.23544311523438,福井県福井市高木中央2-3119,jageocoder
広島県福山市新市町戸手582-1,34.54929733276367,133.28668212890625,広島県福山市新市町戸手582-1,jageocoder
広島県福山市箕島町5816-110,34.45393753051758,133.3909912109375,広島県福山市箕島町5816-110,jageocoder
広島県福山市南蔵王町1-7-7,34.502628326416016,133.39004516601562,広島県福山市南蔵王町1-7-7,jageocoder
福岡県福岡市西区北原2-7-35,33.58109664916992,130.2526092529297,福岡県福岡市西区北原2-7-35,jageocoder
福岡県福岡市東区土井1-8-28,33.63500213623047,130.46275329589844,福岡県福岡市東区土井1-8-28,jageocoder
福岡県福岡市西区姪浜駅南2-24-3,33.57819747924805,130.32705688476562,福岡県福岡市西区姪浜駅南2-24-3,jageocoder
福岡県糟屋郡宇美町光正寺1-8-30,33.57586669921875,130.49859619140625,福岡県糟屋郡宇美町光正寺1-8-30,jageocoder
福岡県糟屋郡新宮町三代西2-4-6,33.6983757019043,130.4514617919922,福岡県糟屋郡新宮町三代西2-4-6,jageocoder
福岡県福岡市早良区重留1-1-11,33.535404205322266,130.34263610839844,福岡県福岡市早良区重留1-1-11,jageocoder
福岡県福岡市中央区警固3-6-1,33.577606201171875,130.3896484375,福岡県福岡市中央区警固3-6-1,jageocoder
福岡県糟屋郡志免町別府三-5-1,33.60441207885742,130.45655822753906,福岡県糟屋郡志免町別府三-5-1,jageocoder
福岡県行橋市行事6-5-35,33.733787536621094,130.96878051757812,福岡県行橋市行事6-5-35,jageocoder
福岡県福岡市南区野多目1-12-43,33.54212951660156,130.42381286621094,福岡県福岡市南区野多目1-12-43,jageocoder
福島県福島市南矢野目谷地70-2,37.7883186340332,140.4534149169922,福島県福島市南矢野目谷地70-2,jageocoder
福島県福島市吉倉字前田46-1,37.745601654052734,140.44525146484375,福島県福島市吉倉字前田46-1,jageocoder
福島県福島市松山町78-4,37.77521514892578,140.48509216308594,福島県福島市松山町78-4,jageocoder
福岡県福津市日蒔野六-23-10,33.7533073425293,130.4908905029297,福岡県福津市日蒔野六-23-10,jageocoder
京都府福知山市末広町2-1-,35.29761505126953,135.11636352539062,京都府福知山市末広町2-1-,jageocoder
秋田県秋田市八橋本町3-21-34,39.727073669433594,140.09909057617188,秋田県秋田市八橋本町3-21-34,jageocoder
秋田県秋田市外旭川字大谷地29-1,39.75492477416992,140.09527587890625,秋田県秋田市外旭川字大谷地29-1,jageocoder
埼玉県秩父市下影森809-1,35.98073959350586,139.0748748779297,埼玉県秩父市下影森809-1,jageocoder
千葉県千葉市稲毛区園生町154-1,35.647186279296875,140.1012420654297,千葉県千葉市稲毛区園生町154-1,jageocoder
千葉県千葉市稲毛区小深町132-1,35.65837860107422,140.15008544921875,千葉県千葉市稲毛区小深町132-1,jageocoder
長野県安曇野市穂高2535-1,36.336753845214844,137.88954162597656,長野県安曇野市穂高2535-1,jageocoder
東京都立川市柏町2-34-1,35.72160720825195,139.4121551513672,東京都立川市柏町2-34-1,jageocoder
兵庫県尼崎市稲葉元町1-1-15,34.73799133300781,135.38897705078125,兵庫県尼崎市稲葉元町1-1-15,jageocoder
山梨県笛吹市石和町広瀬1195-59,35.64458465576172,138.61972045898438,山梨県笛吹市石和町広瀬1195-59,jageocoder
茨城県筑西市布川1317-1,36.29125213623047,139.91876220703125,茨城県筑西市布川1317-1,jageocoder
鳥取県米子市上福原3-2-15,35.44623947143555,133.35104370117188,鳥取県米子市上福原3-2-15,jageocoder
鳥取県米子市夜見町2937-3,35.46904754638672,133.30633544921875,鳥取県米子市夜見町2937-3,jageocoder
山形県米沢市金池5-13-8,37.92475509643555,140.1184844970703,山形県米沢市金池5-13-8,jageocoder
沖縄県糸満市西崎町四-22-3,26.142742156982422,127.6607894897461,沖縄県糸満市西崎町四-22-3,jageocoder
新潟県糸魚川市南押上三-1-25,37.04604721069336,137.87945556640625,新潟県糸魚川市南押上三-1-25,jageocoder
兵庫県姫路市網干区和久字下丁田12-1,34.80889129638672,134.58592224121094,兵庫県姫路市網干区和久字下丁田12-1,jageocoder
北海道網走市駒場北五-83-12 駒場ショッピングタウンアルサキット内,44.00153350830078,144.28427124023438,北海道網走市駒場北五-83-12 駒場ショッピングタウンアルサキット内,jageocoder
岡山県総社市中央5-4-108,34.668766021728516,133.75201416015625,岡山県総社市中央5-4-108,jageocoder
大阪府大阪市東成区東今里2-6-28,34.679039001464844,135.54928588867188,大阪府大阪市東成区東今里2-6-28,jageocoder
東京都練馬区中村1-15-37,35.73181915283203,139.64743041992188,東京都練馬区中村1-15-37,jageocoder
東京都練馬区高松4-21-5,35.75100326538086,139.6259307861328,東京都練馬区高松4-21-5,jageocoder
大阪府堺市美原区黒山44-,34.5421028137207,135.56202697753906,大阪府堺市美原区黒山44-,jageocoder
岐阜県美濃加茂市山手町2-41 3/8(日)をもちまして閉店致しました。 永らくのご愛顧、誠にありがとうございました。 -,35.45254898071289,137.01422119140625,岐阜県美濃加茂市山手町2-41 3/8(日)をもちまして閉店致しました。 永らくのご愛顧、誠にありがとうございました。 -,jageocoder
群馬県館林市北成島町2573-1,36.254310607910156,139.51979064941406,群馬県館林市北成島町2573-1,jageocoder
岐阜県羽島市竹鼻町飯柄22-1,35.32072067260742,136.7156982421875,岐阜県羽島市竹鼻町飯柄22-1,jageocoder
大阪府羽曳野市野466-1,34.559810638427734,135.57431030273438,大阪府羽曳野市野466-1,jageocoder
埼玉県羽生市大字下岩瀬490-2,36.16069412231445,139.53028869628906,埼玉県羽生市大字下岩瀬490-2,jageocoder
秋田県能代市長崎41-1,40.1866340637207,140.0235137939453,秋田県能代市長崎41-1,jageocoder
栃木県下野市烏ヶ森1-1-1,36.38526916503906,139.8544158935547,栃木県下野市烏ヶ森1-1-1,jageocoder
千葉県船橋市金杉8-7-22,35.7330207824707,140.01429748535156,千葉県船橋市金杉8-7-22,jageocoder
北海道苫小牧市住吉町2-7-1,42.65119934082031,141.60623168945312,北海道苫小牧市住吉町2-7-1,jageocoder
北海道苫小牧市弥生町1-9-6,42.62795639038086,141.58258056640625,北海道苫小牧市弥生町1-9-6,jageocoder
北海道苫小牧市北栄町1-23-16,42.67626190185547,141.68972778320312,北海道苫小牧市北栄町1-23-16,jageocoder
千葉県茂原市高師1037-1,35.43339538574219,140.29298400878906,千葉県茂原市高師1037-1,jageocoder
長野県茅野市宮川1131-2,35.99546813964844,138.13438415527344,長野県茅野市宮川1131-2,jageocoder
大阪府茨木市平田2-18-5,34.80565643310547,135.5890655517578,大阪府茨木市平田2-18-5,jageocoder
埼玉県草加市新栄3-2-1,35.8604736328125,139.76853942871094,埼玉県草加市新栄3-2-1,jageocoder
滋賀県草津市草津町1952-1,35.018028259277344,135.9475860595703,滋賀県草津市草津町1952-1,jageocoder
静岡県菊川市半済1078-1,34.75434494018555,138.08880615234375,静岡県菊川市半済1078-1,jageocoder
熊本県菊池市大琳寺字堀ノ内138-1,32.97293472290039,130.80474853515625,熊本県菊池市大琳寺字堀ノ内138-1,jageocoder
京都府京都市右京区西院月双町15-,34.999385833740234,135.72048950195312,京都府京都市右京区西院月双町15-,jageocoder
東京都葛飾区東堀切3-5-6,35.75605392456055,139.8351593017578,東京都葛飾区東堀切3-5-6,jageocoder
東京都葛飾区東水元4-2-1,35.78704833984375,139.86497497558594,東京都葛飾区東水元4-2-1,jageocoder
東京都葛飾区柴又2-14-21,35.75977325439453,139.86756896972656,東京都葛飾区柴又2-14-21,jageocoder
埼玉県蓮田市椿山2-11-9,35.99589920043945,139.65432739257812,埼玉県蓮田市椿山2-11-9,jageocoder
茨城県ひたちなか市新光町30-4,36.40717315673828,140.58421325683594,茨城県ひたちなか市新光町30-4,jageocoder
鹿児島県薩摩川内市国分寺町6965-1,31.82724380493164,130.30311584472656,鹿児島県薩摩川内市国分寺町6965-1,jageocoder
鹿児島県薩摩川内市平佐町1653-4,31.810001373291016,130.32643127441406,鹿児島県薩摩川内市平佐町1653-4,jageocoder
群馬県藤岡市藤岡822-3,36.25371170043945,139.08334350585938,群馬県藤岡市藤岡822-3,jageocoder
神奈川県藤沢市葛原2248,35.406368255615234,139.44015502929688,神奈川県藤沢市葛原2248,jageocoder
埼玉県行田市佐間1-23-14,36.13291549682617,139.45790100097656,埼玉県行田市佐間1-23-14,jageocoder
静岡県袋井市堀越769-1,34.75677490234375,137.91001892089844,静岡県袋井市堀越769-1,jageocoder
静岡県裾野市伊豆島田836-1,35.15332794189453,138.9050750732422,静岡県裾野市伊豆島田836-1,jageocoder
滋賀県長浜市八幡東町9-1,35.386695861816406,136.281982421875,滋賀県長浜市八幡東町9-1,jageocoder
兵庫県西宮市大島町4-22,34.76176834106445,135.36712646484375,兵庫県西宮市大島町4-22,jageocoder
愛知県西尾市上町泡原73-5,34.869407653808594,137.04736328125,愛知県西尾市上町泡原73-5,jageocoder
愛知県西尾市一色町対米九郎左30-1,34.80556106567383,137.03221130371094,愛知県西尾市一色町対米九郎左30-1,jageocoder
埼玉県川越市大字小ヶ谷443,35.919403076171875,139.45619201660156,埼玉県川越市大字小ヶ谷443,jageocoder
大阪府大阪市西成区津守3-5-56,34.63835144042969,135.4828338623047,大阪府大阪市西成区津守3-5-56,jageocoder
愛知県北名古屋市徳重大日51-1,35.25558853149414,136.8673858642578,愛知県北名古屋市徳重大日51-1,jageocoder
神奈川県横浜市戸塚区品濃町537-1 西武東戸塚S.C. 西武館5F,35.43033218383789,139.5584716796875,神奈川県横浜市戸塚区品濃町537-1 西武東戸塚S.C. 西武館5F,jageocoder
大阪府大阪市西淀川区歌島2-3-5,34.712928771972656,135.46316528320312,大阪府大阪市西淀川区歌島2-3-5,jageocoder
京都府舞鶴市女布2-172,35.42903137207031,135.32174682617188,京都府舞鶴市女布2-172,jageocoder
栃木県那須塩原市新南163-504,36.88402557373047,139.99700927734375,栃木県那須塩原市新南163-504,jageocoder
東京都大田区南馬込5-35-2,35.58536148071289,139.7068634033203,東京都大田区南馬込5-35-2,jageocoder
新潟県見附市葛巻町1670-1,37.52955627441406,138.9089813232422,新潟県見附市葛巻町1670-1,jageocoder
東京都調布市佐須町4-68-15,35.65990447998047,139.55621337890625,東京都調布市佐須町4-68-15,jageocoder
長野県諏訪市上川3-2370,36.02986526489258,138.11849975585938,長野県諏訪市上川3-2370,jageocoder
長崎県諫早市森山町田尻1900-1,32.82530975341797,130.1479949951172,長崎県諫早市森山町田尻1900-1,jageocoder
大阪府豊中市服部豊町2-20-20,34.7642822265625,135.46824645996094,大阪府豊中市服部豊町2-20-20,jageocoder
大阪府豊中市永楽荘2-4-8,34.81330490112305,135.46871948242188,大阪府豊中市永楽荘2-4-8,jageocoder
兵庫県豊岡市九日市中町字権現132-17,35.524845123291016,134.82147216796875,兵庫県豊岡市九日市中町字権現132-17,jageocoder
愛知県豊橋市中岩田2-8-7,34.753868103027344,137.42604064941406,愛知県豊橋市中岩田2-8-7,jageocoder
愛知県豊橋市三ツ相町365-,34.77305221557617,137.36163330078125,愛知県豊橋市三ツ相町365-,jageocoder
愛知県豊橋市高師町字西沢120-2,34.72317123413086,137.38575744628906,愛知県豊橋市高師町字西沢120-2,jageocoder
愛知県豊田市丸山町4-12-1,35.064327239990234,137.15097045898438,愛知県豊田市丸山町4-12-1,jageocoder
沖縄県豊見城市字根差部658-1,26.188671112060547,127.68867492675781,沖縄県豊見城市字根差部658-1,jageocoder
大阪府貝塚市半田一-10-39,34.43757247924805,135.3749237060547,大阪府貝塚市半田一-10-39,jageocoder
岡山県赤磐市高屋394,34.75606155395508,134.02337646484375,岡山県赤磐市高屋394,jageocoder
