address,lat,lng,raw_query,provider
神奈川県大和市下鶴間1785-2,35.50035858154297,139.45343017578125,神奈川県大和市下鶴間1785-2,jageocoder
北海道標津郡中標津町南町3-10 東武サウスヒルズ内,43.5356330871582,144.97821044921875,北海道標津郡中標津町南町3-10 東武サウスヒルズ内,jageocoder
香川県丸亀市山北町50-1,34.26823806762695,133.80062866210938,香川県丸亀市山北町50-1,jageocoder
兵庫県丹波市氷上町横田300-,35.15642166137695,135.0485076904297,兵庫県丹波市氷上町横田300-,jageocoder
岩手県久慈市川崎町16-34,40.19162368774414,141.77720642089844,岩手県久慈市川崎町16-34,jageocoder
福岡県久留米市御井町字大銃場2228-4,33.299232482910156,130.55067443847656,福岡県久留米市御井町字大銃場2228-4,jageocoder
福岡県久留米市三潴町福光562-2,33.2466926574707,130.4565887451172,福岡県久留米市三潴町福光562-2,jageocoder
福岡県久留米市梅満町490-2,33.31072998046875,130.5035400390625,福岡県久留米市梅満町490-2,jageocoder
京都府亀岡市篠町篠杢殿林12-1,35.00177764892578,135.60630798339844,京都府亀岡市篠町篠杢殿林12-1,jageocoder
岩手県二戸市金田一字八ツ長38-13,40.31022644042969,141.30804443359375,岩手県二戸市金田一字八ツ長38-13,jageocoder
兵庫県明石市二見町西二見31-9,34.71334457397461,134.8898162841797,兵庫県明石市二見町西二見31-9,jageocoder
東京都品川区西五反田7-22-17 TOCビル地下1F,35.62141799926758,139.7196044921875,東京都品川区西五反田7-22-17 TOCビル地下1F,jageocoder
京都府京都市右京区西院月双町98,34.996822357177734,135.72048950195312,京都府京都市右京区西院月双町98,jageocoder
京都府京都市下京区烏丸通七条下ル東塩小路町590-2 京都ヨドバシ4階,34.98822021484375,135.75894165039062,京都府京都市下京区烏丸通七条下ル東塩小路町590-2 京都ヨドバシ4階,jageocoder
京都府京都市西京区川島調子町11-1,34.97303009033203,135.6982879638672,京都府京都市西京区川島調子町11-1,jageocoder
愛媛県今治市山路884-2,34.05817413330078,132.9728240966797,愛媛県今治市山路884-2,jageocoder
愛媛県今治市衣干町四-4-6,34.04513931274414,133.01300048828125,愛媛県今治市衣干町四-4-6,jageocoder
宮城県仙台市泉区南中山1-42-1,38.297637939453125,140.82566833496094,宮城県仙台市泉区南中山1-42-1,jageocoder
宮城県仙台市青葉区栗生6-11-4,38.26832962036133,140.78233337402344,宮城県仙台市青葉区栗生6-11-4,jageocoder
宮城県仙台市若林区蒲町東19-の7,38.24406433105469,140.93472290039062,宮城県仙台市若林区蒲町東19-の7,jageocoder
佐賀県伊万里市二里町八谷搦字伊万里一本松1148-,33.27821731567383,129.87049865722656,佐賀県伊万里市二里町八谷搦字伊万里一本松1148-,jageocoder
兵庫県伊丹市鴻池町7-3-10,34.80443572998047,135.38418579101562,兵庫県伊丹市鴻池町7-3-10,jageocoder
兵庫県伊丹市行基町1-103-,34.7814826965332,135.40780639648438,兵庫県伊丹市行基町1-103-,jageocoder
群馬県伊勢崎市田部井町3-180-2,36.34968185424805,139.25601196289062,群馬県伊勢崎市田部井町3-180-2,jageocoder
群馬県伊勢崎市南千木町5202-3 西友楽市伊勢崎茂呂SC内,36.29689025878906,139.2151641845703,群馬県伊勢崎市南千木町5202-3 西友楽市伊勢崎茂呂SC内,jageocoder
群馬県伊勢崎市連取町1475-1,36.318443298339844,139.18299865722656,群馬県伊勢崎市連取町1475-1,jageocoder
埼玉県北足立郡伊奈町寿3-138,36.00792694091797,139.6065673828125,埼玉県北足立郡伊奈町寿3-138,jageocoder
兵庫県神戸市西区北別府5-1-5,34.671653747558594,135.00697326660156,兵庫県神戸市西区北別府5-1-5,jageocoder
静岡県伊東市川奈1259-2,34.94486999511719,139.1182403564453,静岡県伊東市川奈1259-2,jageocoder
福島県伊達市保原町字竹内町71,37.81477737426758,140.54750061035156,福島県伊達市保原町字竹内町71,jageocoder
北海道伊達市舟岡町205-24,42.46525573730469,140.87986755371094,北海道伊達市舟岡町205-24,jageocoder
長野県伊那市下新田3030-1,35.82771682739258,137.95797729492188,長野県伊那市下新田3030-1,jageocoder
福島県会津若松市町北町大字始字宮前15-1 会津若松アピオ内,37.51844024658203,139.91531372070312,福島県会津若松市町北町大字始字宮前15-1 会津若松アピオ内,jageocoder
福島県会津若松市南花畑2-65,37.48554229736328,139.92237854003906,福島県会津若松市南花畑2-65,jageocoder
大阪府大阪市住吉区遠里小野2-10-32,34.59852981567383,135.49786376953125,大阪府大阪市住吉区遠里小野2-10-32,jageocoder
長崎県佐世保市矢峰町223-1,33.21200180053711,129.74444580078125,長崎県佐世保市矢峰町223-1,jageocoder
長野県小諸市御影新田2291-1,36.30104064941406,138.46681213378906,長野県小諸市御影新田2291-1,jageocoder
千葉県佐倉市上座字西谷津665-1,35.7252082824707,140.15782165527344,千葉県佐倉市上座字西谷津665-1,jageocoder
千葉県佐倉市石川字奥行台644-1,35.6968879699707,140.22915649414062,千葉県佐倉市石川字奥行台644-1,jageocoder
千葉県香取市佐原イ4215-1,35.900997161865234,140.49163818359375,千葉県香取市佐原イ4215-1,jageocoder
新潟県佐渡市市野沢字金山151,38.00910186767578,138.33851623535156,新潟県佐渡市市野沢字金山151,jageocoder
佐賀県佐賀市鍋島町大字八戸3181-2,33.25559616088867,130.26683044433594,佐賀県佐賀市鍋島町大字八戸3181-2,jageocoder
栃木県佐野市高萩町字溜ノ上693-1,36.304779052734375,139.5944061279297,栃木県佐野市高萩町字溜ノ上693-1,jageocoder
北海道余市郡余市町黒川町8-49-1,43.18488693237305,140.7939453125,北海道余市郡余市町黒川町8-49-1,jageocoder
東京都練馬区南大泉3-13-31 いなげや2F,35.745262145996094,139.57130432128906,東京都練馬区南大泉3-13-31 いなげや2F,jageocoder
長野県中野市一本木11,36.75840377807617,138.3700408935547,長野県中野市一本木11,jageocoder
鳥取県倉吉市河北町102,35.46602249145508,133.84494018554688,鳥取県倉吉市河北町102,jageocoder
岡山県倉敷市平田81-1,34.614662170410156,133.77305603027344,岡山県倉敷市平田81-1,jageocoder
岡山県倉敷市玉島乙島7121-1,34.534542083740234,133.68148803710938,岡山県倉敷市玉島乙島7121-1,jageocoder
東京都八王子市元八王子町2-1975 2/20(金)をもちまして閉店致しました。 永らくのご愛顧、誠にありがとうございました。 -,35.6549186706543,139.28176879882812,東京都八王子市元八王子町2-1975 2/20(金)をもちまして閉店致しました。 永らくのご愛顧、誠にありがとうございました。 -,jageocoder
山口県光市木園1-5-28,33.97780227661133,131.92991638183594,山口県光市木園1-5-28,jageocoder
埼玉県入間市東藤沢2-1-9,35.82218551635742,139.41383361816406,埼玉県入間市東藤沢2-1-9,jageocoder
熊本県八代市田中町465-1,32.518245697021484,130.60787963867188,熊本県八代市田中町465-1,jageocoder
千葉県八千代市大和田新田111-8,35.722110748291016,140.0839385986328,千葉県八千代市大和田新田111-8,jageocoder
大阪府八尾市太田三-223-1,34.592376708984375,135.58694458007812,大阪府八尾市太田三-223-1,jageocoder
大阪府八尾市跡部本町1-1-40,34.61843490600586,135.58541870117188,大阪府八尾市跡部本町1-1-40,jageocoder
福岡県北九州市八幡西区下上津役4-21-1,33.826107025146484,130.74456787109375,福岡県北九州市八幡西区下上津役4-21-1,jageocoder
大阪府東大阪市若江西新町1-14-1,34.66257858276367,135.59613037109375,大阪府東大阪市若江西新町1-14-1,jageocoder
青森県八戸市長根四-5-24,40.51818084716797,141.47982788085938,青森県八戸市長根四-5-24,jageocoder
青森県八戸市新井田西2-24-23,40.49939727783203,141.52056884765625,青森県八戸市新井田西2-24-23,jageocoder
滋賀県東近江市中小路町字石倉609,35.097774505615234,136.2273712158203,滋賀県東近江市中小路町字石倉609,jageocoder
埼玉県八潮市大字南後谷420-1,35.82863235473633,139.81814575195312,埼玉県八潮市大字南後谷420-1,jageocoder
東京都八王子市西片倉2-6-7,35.63478088378906,139.33042907714844,東京都八王子市西片倉2-6-7,jageocoder
千葉県八街市富山1314-3425,35.67488479614258,140.29415893554688,千葉県八街市富山1314-3425,jageocoder
新潟県南魚沼市余川3100 イオン六日町店敷地内,37.08113098144531,138.87864685058594,新潟県南魚沼市余川3100 イオン六日町店敷地内,jageocoder
島根県出雲市今市町87- ラピタ本店2階,35.36848449707031,132.7538299560547,島根県出雲市今市町87- ラピタ本店2階,jageocoder
島根県出雲市大塚町794-1,35.37621307373047,132.75265502929688,島根県出雲市大塚町794-1,jageocoder
島根県出雲市平田町7155 シェルピア中ノ島内,35.440128326416016,132.82359313964844,島根県出雲市平田町7155 シェルピア中ノ島内,jageocoder
北海道函館市美原1-3-1 2F,41.81375503540039,140.758544921875,北海道函館市美原1-3-1 2F,jageocoder
北海道函館市亀田港町39-13,41.8094482421875,140.72125244140625,北海道函館市亀田港町39-13,jageocoder
北海道函館市広野町5-10,41.7754020690918,140.76654052734375,北海道函館市広野町5-10,jageocoder
北海道函館市石川町326-16,41.825584411621094,140.74050903320312,北海道函館市石川町326-16,jageocoder
大分県別府市山の手町9-16,33.281341552734375,131.4852294921875,大分県別府市山の手町9-16,jageocoder
宮城県宮城郡利府町加瀬字新前谷地10-1,38.32953643798828,140.97645568847656,宮城県宮城郡利府町加瀬字新前谷地10-1,jageocoder
福岡県糸島市波多江駅南1-6-1,33.56240463256836,130.22679138183594,福岡県糸島市波多江駅南1-6-1,jageocoder
群馬県前橋市六供町二-31-32,36.374664306640625,139.07073974609375,群馬県前橋市六供町二-31-32,jageocoder
兵庫県加古川市別府町石町95-1,34.72731018066406,134.84652709960938,兵庫県加古川市別府町石町95-1,jageocoder
兵庫県加古川市加古川町北在家755-1,34.75672149658203,134.8335418701172,兵庫県加古川市加古川町北在家755-1,jageocoder
埼玉県上尾市上平中央三-38-7,35.99446487426758,139.58511352539062,埼玉県上尾市上平中央三-38-7,jageocoder
北海道北広島市虹ヶ丘7-2-1,43.0217399597168,141.48805236816406,北海道北広島市虹ヶ丘7-2-1,jageocoder
埼玉県北本市本宿2-69-,36.02880859375,139.5388946533203,埼玉県北本市本宿2-69-,jageocoder
北海道北見市西富町1-12-18,43.799007415771484,143.86721801757812,北海道北見市西富町1-12-18,jageocoder
沖縄県中頭郡北谷町北谷2-18-4,26.3056697845459,127.7607192993164,沖縄県中頭郡北谷町北谷2-18-4,jageocoder
岡山県岡山市北区北長瀬表町1-2-103,34.65198516845703,133.8933868408203,岡山県岡山市北区北長瀬表町1-2-103,jageocoder
兵庫県神戸市須磨区多井畑字渋人谷上4-1 ミリオンタウン2階,34.66811752319336,135.10317993164062,兵庫県神戸市須磨区多井畑字渋人谷上4-1 ミリオンタウン2階,jageocoder
青森県十和田市東一-町1-30,40.62141418457031,141.2123260498047,青森県十和田市東一-町1-30,jageocoder
長野県千曲市粟佐1212-1,36.539466857910156,138.120849609375,長野県千曲市粟佐1212-1,jageocoder
北海道千歳市住吉4-14-20,42.831077575683594,141.6720428466797,北海道千歳市住吉4-14-20,jageocoder
北海道千歳市新富3-23-11,42.83781433105469,141.63763427734375,北海道千歳市新富3-23-11,jageocoder
千葉県千葉市緑区あすみが丘東3-1-9,35.52499008178711,140.28074645996094,千葉県千葉市緑区あすみが丘東3-1-9,jageocoder
千葉県印西市中央南2-5- アクロスプラザ千葉ニュ-タウン南内,35.798500061035156,140.11329650878906,千葉県印西市中央南2-5- アクロスプラザ千葉ニュ-タウン南内,jageocoder
千葉県柏市北柏4-8-2,35.869049072265625,139.98858642578125,千葉県柏市北柏4-8-2,jageocoder
千葉県千葉市中央区末広5-6-1,35.58772659301758,140.13026428222656,千葉県千葉市中央区末広5-6-1,jageocoder
千葉県千葉市花見川区作新台4-17-2,35.6899299621582,140.07876586914062,千葉県千葉市花見川区作新台4-17-2,jageocoder
愛知県半田市柊町5-6-8,34.90049362182617,136.91024780273438,愛知県半田市柊町5-6-8,jageocoder
兵庫県南あわじ市広田広田字大御門586,34.32932662963867,134.83753967285156,兵庫県南あわじ市広田広田字大御門586,jageocoder
鹿児島県南さつま市加世田本町16-2,31.41996955871582,130.32260131835938,鹿児島県南さつま市加世田本町16-2,jageocoder
山梨県南アルプス市十五所684-1 南アルプスガ-デン内,35.618309020996094,138.47055053710938,山梨県南アルプス市十五所684-1 南アルプスガ-デン内,jageocoder
埼玉県さいたま市中央区鈴谷2-667,35.86989974975586,139.62832641601562,埼玉県さいたま市中央区鈴谷2-667,jageocoder
千葉県流山市南流山4-3-5,35.84027862548828,139.9035186767578,千葉県流山市南流山4-3-5,jageocoder
東京都町田市南町田5-1-7,35.51491928100586,139.47396850585938,東京都町田市南町田5-1-7,jageocoder
山形県南陽市郡山561-2,38.04315185546875,140.15611267089844,山形県南陽市郡山561-2,jageocoder
福岡県福岡市博多区井相田1-7-37,33.55739974975586,130.4608917236328,福岡県福岡市博多区井相田1-7-37,jageocoder
神奈川県厚木市下荻野1393-5,35.47798538208008,139.34017944335938,神奈川県厚木市下荻野1393-5,jageocoder
神奈川県厚木市愛甲三-8-29,35.423465728759766,139.34896850585938,神奈川県厚木市愛甲三-8-29,jageocoder
福島県南相馬市原町区高見町1-123-1,37.639564514160156,140.98406982421875,福島県南相馬市原町区高見町1-123-1,jageocoder
茨城県取手市藤代579-,35.92198944091797,140.1139678955078,茨城県取手市藤代579-,jageocoder
宮城県大崎市古川旭1-14-18,38.56768035888672,140.97378540039062,宮城県大崎市古川旭1-14-18,jageocoder
宮城県大崎市古川穂波3-4-1,38.56550216674805,140.94625854492188,宮城県大崎市古川穂波3-4-1,jageocoder
茨城県古河市松並二-18-23,36.207855224609375,139.70919799804688,茨城県古河市松並二-18-23,jageocoder
茨城県古河市関戸2014-1,36.192527770996094,139.74530029296875,茨城県古河市関戸2014-1,jageocoder
岐阜県可児市中恵土2371-431,35.43491744995117,137.06478881835938,岐阜県可児市中恵土2371-431,jageocoder
岐阜県各務原市蘇原花園町2-7 イオンタウン各務原内,35.4120979309082,136.84803771972656,岐阜県各務原市蘇原花園町2-7 イオンタウン各務原内,jageocoder
群馬県北群馬郡吉岡町大久保313-7,36.43205642700195,139.02108764648438,群馬県北群馬郡吉岡町大久保313-7,jageocoder
徳島県吉野川市鴨島町上下島108-1,34.07000732421875,134.35174560546875,徳島県吉野川市鴨島町上下島108-1,jageocoder
宮城県名取市杜せきのした3-7-10,38.164207458496094,140.9023895263672,宮城県名取市杜せきのした3-7-10,jageocoder
愛知県名古屋市北区苗田町80-,35.23690414428711,136.91738891601562,愛知県名古屋市北区苗田町80-,jageocoder
愛知県名古屋市天白区原3-906,35.121150970458984,136.99081420898438,愛知県名古屋市天白区原3-906,jageocoder
愛知県名古屋市港区当知2-701-,35.107181549072266,136.85061645507812,愛知県名古屋市港区当知2-701-,jageocoder
愛知県名古屋市緑区細口2-608-,35.086647033691406,136.98838806152344,愛知県名古屋市緑区細口2-608-,jageocoder
愛知県名古屋市港区東茶屋二-412-,35.10548400878906,136.8287811279297,愛知県名古屋市港区東茶屋二-412-,jageocoder
北海道名寄市徳田105-30,44.33608627319336,142.45657348632812,北海道名寄市徳田105-30,jageocoder
沖縄県名護市大南一-13-24,26.594602584838867,127.97869110107422,沖縄県名護市大南一-13-24,jageocoder
京都府向日市鶏冠井町十相1-1,34.94498062133789,135.71145629882812,京都府向日市鶏冠井町十相1-1,jageocoder
千葉県君津市中野4-3-5,35.3309440612793,139.8926239013672,千葉県君津市中野4-3-5,jageocoder
大阪府吹田市青葉丘南4-2,34.80587387084961,135.55445861816406,大阪府吹田市青葉丘南4-2,jageocoder
広島県呉市宮原十三-3-18,34.220577239990234,132.55252075195312,広島県呉市宮原十三-3-18,jageocoder
広島県呉市広古新開8-32-23,34.24264144897461,132.6230926513672,広島県呉市広古新開8-32-23,jageocoder
広島県呉市焼山西3-4-12101,34.293846130371094,132.55250549316406,広島県呉市焼山西3-4-12101,jageocoder
和歌山県岩出市中黒字高圦528-1,34.26905059814453,135.28541564941406,和歌山県岩出市中黒字高圦528-1,jageocoder
和歌山県和歌山市栗栖37-,34.23792266845703,135.22525024414062,和歌山県和歌山市栗栖37-,jageocoder
和歌山県和歌山市梶取162-1,34.25169372558594,135.15611267089844,和歌山県和歌山市梶取162-1,jageocoder
和歌山県橋本市小原田字佃567-1,34.32339096069336,135.60670471191406,和歌山県橋本市小原田字佃567-1,jageocoder
和歌山県和歌山市次郎丸5-9,34.25455856323242,135.15283203125,和歌山県和歌山市次郎丸5-9,jageocoder
大阪府和泉市和気町1-6-19,34.476097106933594,135.42672729492188,大阪府和泉市和気町1-6-19,jageocoder
兵庫県朝来市和田山町法道寺字新中野809-1,35.358489990234375,134.82272338867188,兵庫県朝来市和田山町法道寺字新中野809-1,jageocoder
佐賀県唐津市和多田本村1-40,33.43810272216797,129.9751434326172,佐賀県唐津市和多田本村1-40,jageocoder
愛媛県四国中央市村松町1-13,33.99135208129883,133.56565856933594,愛媛県四国中央市村松町1-13,jageocoder
三重県四日市市三ツ谷町5-24,34.981632232666016,136.6295166015625,三重県四日市市三ツ谷町5-24,jageocoder
三重県四日市市泊小柳町3-35,34.94068145751953,136.6064910888672,三重県四日市市泊小柳町3-35,jageocoder
大阪府四條畷市西中野3-1-18,34.74375915527344,135.6366729736328,大阪府四條畷市西中野3-1-18,jageocoder
東京都国分寺市東恋ケ窪4-22-8,35.71171569824219,139.46859741210938,東京都国分寺市東恋ケ窪4-22-8,jageocoder
兵庫県尼崎市神崎町24-30,34.74308395385742,135.44679260253906,兵庫県尼崎市神崎町24-30,jageocoder
茨城県土浦市小松1-4-27,36.07206344604492,140.2040252685547,茨城県土浦市小松1-4-27,jageocoder
茨城県土浦市中神立町19-1,36.118263244628906,140.2358856201172,茨城県土浦市中神立町19-1,jageocoder
埼玉県坂戸市にっさい花みず木3-20-5,35.969234466552734,139.3699188232422,埼玉県坂戸市にっさい花みず木3-20-5,jageocoder
兵庫県神戸市垂水区小束山本町3-2-2,34.664276123046875,135.0621795654297,兵庫県神戸市垂水区小束山本町3-2-2,jageocoder
福岡県福岡市城南区長尾3-14-8,33.554046630859375,130.38787841796875,福岡県福岡市城南区長尾3-14-8,jageocoder
埼玉県狭山市廣瀬1-31-30,35.85597229003906,139.38653564453125,埼玉県狭山市廣瀬1-31-30,jageocoder
大阪府堺市西区太平寺711-1,34.51267623901367,135.484619140625,大阪府堺市西区太平寺711-1,jageocoder
大阪府堺市中区東山787,34.52079391479492,135.5081329345703,大阪府堺市中区東山787,jageocoder
大阪府堺市堺区海山町3丁154-3,34.59032440185547,135.47325134277344,大阪府堺市堺区海山町3丁154-3,jageocoder
長野県塩尻市広丘吉田1033-1,36.15944290161133,137.9519500732422,長野県塩尻市広丘吉田1033-1,jageocoder
宮城県多賀城市桜木1-7-1,38.28897476196289,141.01113891601562,宮城県多賀城市桜木1-7-1,jageocoder
大分県大分市古国府五-1-26,33.215728759765625,131.6065216064453,大分県大分市古国府五-1-26,jageocoder
大分県大分市竹下一-8-15,33.24189758300781,131.7286376953125,大分県大分市竹下一-8-15,jageocoder
大分県日田市大字十二町35-1,33.320613861083984,130.92630004882812,大分県日田市大字十二町35-1,jageocoder
大分県大分市明野北5-3-1,33.227176666259766,131.65963745117188,大分県大分市明野北5-3-1,jageocoder
神奈川県大和市福田5678-1,35.45421600341797,139.46640014648438,神奈川県大和市福田5678-1,jageocoder
奈良県大和高田市大字神楽27-1,34.52445983886719,135.7384796142578,奈良県大和高田市大字神楽27-1,jageocoder
秋田県大仙市飯田字屋舗通251,39.445438385009766,140.4820556640625,秋田県大仙市飯田字屋舗通251,jageocoder
愛知県海部郡大治町三本木字金久45-,35.168212890625,136.81732177734375,愛知県海部郡大治町三本木字金久45-,jageocoder
滋賀県大津市打出浜14-30 大津テラス3F,35.004417419433594,135.8799591064453,滋賀県大津市打出浜14-30 大津テラス3F,jageocoder
滋賀県大津市大将軍3-303-,34.99151611328125,135.92889404296875,滋賀県大津市大将軍3-303-,jageocoder
福岡県大牟田市船津町407,33.008155822753906,130.43756103515625,福岡県大牟田市船津町407,jageocoder
島根県大田市長久町土江102-2,35.196781158447266,132.47955322265625,島根県大田市長久町土江102-2,jageocoder
福岡県大野城市乙金3-16-8,33.5428466796875,130.49624633789062,福岡県大野城市乙金3-16-8,jageocoder
大阪府大阪市天王寺区筆ヶ崎町2-22,34.6624641418457,135.52755737304688,大阪府大阪市天王寺区筆ヶ崎町2-22,jageocoder
山形県天童市芳賀タウン北三-11-2,38.344139099121094,140.36146545410156,山形県天童市芳賀タウン北三-11-2,jageocoder
福岡県太宰府市大佐野4-20-6,33.50008010864258,130.487548828125,福岡県太宰府市大佐野4-20-6,jageocoder
群馬県太田市小舞木町263-,36.28327941894531,139.38717651367188,群馬県太田市小舞木町263-,jageocoder
鹿児島県奄美市名瀬朝日町11-2,28.395984649658203,129.52635192871094,鹿児島県奄美市名瀬朝日町11-2,jageocoder
奈良県奈良市古市町1322-3,34.66055679321289,135.83238220214844,奈良県奈良市古市町1322-3,jageocoder
奈良県葛城市北花内174,34.483970642089844,135.73291015625,奈良県葛城市北花内174,jageocoder
兵庫県姫路市増位新町2-26,34.856895446777344,134.7083282470703,兵庫県姫路市増位新町2-26,jageocoder
大分県宇佐市大字葛原字東ノ田233-1,33.53462219238281,131.34014892578125,大分県宇佐市大字葛原字東ノ田233-1,jageocoder
熊本県宇土市善道寺町綾織95 宇土シティモ-ル 2階,32.6844367980957,130.66860961914062,熊本県宇土市善道寺町綾織95 宇土シティモ-ル 2階,jageocoder
京都府宇治市大久保町田原67-1,34.87379455566406,135.7643585205078,京都府宇治市大久保町田原67-1,jageocoder
山口県宇部市小松原町2-10-61,33.96482467651367,131.23928833007812,山口県宇部市小松原町2-10-61,jageocoder
山口県宇部市東見初町1-22,33.93583297729492,131.25526428222656,山口県宇部市東見初町1-22,jageocoder
栃木県宇都宮市ゆいの杜6-30-20,36.56822204589844,139.998291015625,栃木県宇都宮市ゆいの杜6-30-20,jageocoder
栃木県宇都宮市岩曽町字沢向1177-41,36.584693908691406,139.90924072265625,栃木県宇都宮市岩曽町字沢向1177-41,jageocoder
栃木県宇都宮市東簗瀬1-25-1,36.54098129272461,139.89859008789062,栃木県宇都宮市東簗瀬1-25-1,jageocoder
大阪府守口市寺方本通三-1-10,34.72483825683594,135.57765197753906,大阪府守口市寺方本通三-1-10,jageocoder
愛知県名古屋市守山区下志段味三-1308- ライフガ-デン志段味西内,35.244651794433594,137.015869140625,愛知県名古屋市守山区下志段味三-1308- ライフガ-デン志段味西内,jageocoder
滋賀県守山市焔魔堂町247-1,35.05119323730469,135.98355102539062,滋賀県守山市焔魔堂町247-1,jageocoder
茨城県守谷市久保ヶ丘2-1-1 守谷テラス内1階,35.967769622802734,139.97476196289062,茨城県守谷市久保ヶ丘2-1-1 守谷テラス内1階,jageocoder
茨城県守谷市中央一-1-,35.95429992675781,139.98765563964844,茨城県守谷市中央一-1-,jageocoder
群馬県安中市岩井2423-1,36.33252716064453,138.926513671875,群馬県安中市岩井2423-1,jageocoder
愛知県安城市城南町1-3-2,34.9534797668457,137.07952880859375,愛知県安城市城南町1-3-2,jageocoder
福岡県宗像市稲元2-4-15,33.808677673339844,130.55123901367188,福岡県宗像市稲元2-4-15,jageocoder
沖縄県宜野湾市宇地泊三-5-23,26.269817352294922,127.73069763183594,沖縄県宜野湾市宇地泊三-5-23,jageocoder
兵庫県宝塚市山本丸橋3-10-1,34.81310272216797,135.39381408691406,兵庫県宝塚市山本丸橋3-10-1,jageocoder
兵庫県宝塚市逆瀬川1-13-1 アピア3 1階,34.79818344116211,135.35153198242188,兵庫県宝塚市逆瀬川1-13-1 アピア3 1階,jageocoder
北海道室蘭市中島本町1-6-2,42.35457992553711,141.0097198486328,北海道室蘭市中島本町1-6-2,jageocoder
宮崎県宮崎市大淀四-7-30 宮交シティ3F,31.895156860351562,131.4188690185547,宮崎県宮崎市大淀四-7-30 宮交シティ3F,jageocoder
岩手県宮古市南町12-20,39.63853073120117,141.9472198486328,岩手県宮古市南町12-20,jageocoder
