address,lat,lng,raw_query,provider
宮崎県宮崎市まなび野2-35-2,31.85959243774414,131.4190673828125,宮崎県宮崎市まなび野2-35-2,jageocoder
宮崎県宮崎市吉村町長田甲2358,31.912363052368164,131.44680786132812,宮崎県宮崎市吉村町長田甲2358,jageocoder
宮崎県宮崎市浮城町67-1,31.929662704467773,131.43833923339844,宮崎県宮崎市浮城町67-1,jageocoder
宮崎県宮崎市薫る坂1-19-2,31.895429611206055,131.39842224121094,宮崎県宮崎市薫る坂1-19-2,jageocoder
宮崎県児湯郡高鍋町大字北高鍋3241,32.124755859375,131.51988220214844,宮崎県児湯郡高鍋町大字北高鍋3241,jageocoder
静岡県富士市伝法2619-95,35.17573928833008,138.66883850097656,静岡県富士市伝法2619-95,jageocoder
山梨県富士吉田市中曽根4-8-20,35.47896957397461,138.8092498779297,山梨県富士吉田市中曽根4-8-20,jageocoder
静岡県富士宮市若の宮町237-1,35.2314338684082,138.61708068847656,静岡県富士宮市若の宮町237-1,jageocoder
富山県富山市下飯野416-,36.74030303955078,137.2541046142578,富山県富山市下飯野416-,jageocoder
富山県富山市本郷町50--2,36.667877197265625,137.23118591308594,富山県富山市本郷町50--2,jageocoder
群馬県富岡市富岡1649-1,36.26355743408203,138.892333984375,群馬県富岡市富岡1649-1,jageocoder
大阪府富田林市若松町西1-1824-1,34.506370544433594,135.6002960205078,大阪府富田林市若松町西1-1824-1,jageocoder
宮城県富谷市大清水2-13-1,38.36503219604492,140.87840270996094,宮城県富谷市大清水2-13-1,jageocoder
山形県寒河江市大字寒河江内の袋33-,38.375274658203125,140.26084899902344,山形県寒河江市大字寒河江内の袋33-,jageocoder
大阪府寝屋川市大成町13-19,34.75044250488281,135.62435913085938,大阪府寝屋川市大成町13-19,jageocoder
福岡県北九州市小倉南区上曽根新町10-5 アクロスプラザ上曽根内,33.81759262084961,130.94992065429688,福岡県北九州市小倉南区上曽根新町10-5 アクロスプラザ上曽根内,jageocoder
福岡県北九州市小倉南区長尾1-11-30,33.82373809814453,130.8587188720703,福岡県北九州市小倉南区長尾1-11-30,jageocoder
佐賀県小城市小城町畑田2526-1,33.29343032836914,130.1902618408203,佐賀県小城市小城町畑田2526-1,jageocoder
栃木県小山市東城南1-34,36.29471206665039,139.81214904785156,栃木県小山市東城南1-34,jageocoder
東京都小平市鈴木町一-272-,35.724464416503906,139.49998474121094,東京都小平市鈴木町一-272-,jageocoder
石川県小松市今江町4-186-,36.38255310058594,136.4475860595703,石川県小松市今江町4-186-,jageocoder
宮崎県小林市水流迫237-1,31.983057022094727,130.99954223632812,宮崎県小林市水流迫237-1,jageocoder
北海道小樽市有幌町2-9,43.19027328491211,141.00953674316406,北海道小樽市有幌町2-9,jageocoder
愛知県小牧市小牧原新田1425-1,35.30103302001953,136.92491149902344,愛知県小牧市小牧原新田1425-1,jageocoder
兵庫県小野市敷地町1502-11,34.8580207824707,134.9366455078125,兵庫県小野市敷地町1502-11,jageocoder
東京都小金井市緑町2-2-4,35.70507049560547,139.521240234375,東京都小金井市緑町2-2-4,jageocoder
東京都小金井市貫井南町2-2-22,35.693023681640625,139.4978790283203,東京都小金井市貫井南町2-2-22,jageocoder
兵庫県尼崎市西長洲町2-1-36,34.72756576538086,135.4235076904297,兵庫県尼崎市西長洲町2-1-36,jageocoder
広島県尾道市高須町4789-11,34.4313850402832,133.23776245117188,広島県尾道市高須町4789-11,jageocoder
山口県山口市平井44-1,34.161983489990234,131.47137451171875,山口県山口市平井44-1,jageocoder
山形県山形市若宮1-5-1,38.227622985839844,140.3128662109375,山形県山形市若宮1-5-1,jageocoder
山形県山形市桧町3-5-11,38.27605438232422,140.32843017578125,山形県山形市桧町3-5-11,jageocoder
京都府京都市山科区勧修寺東栗栖野町10-,34.97090530395508,135.8084716796875,京都府京都市山科区勧修寺東栗栖野町10-,jageocoder
岐阜県岐阜市又丸30-1,35.4409294128418,136.70391845703125,岐阜県岐阜市又丸30-1,jageocoder
岐阜県岐阜市正木北町4-21,35.45322799682617,136.74888610839844,岐阜県岐阜市正木北町4-21,jageocoder
岐阜県岐阜市茜部辰新1-67-1,35.38102722167969,136.76206970214844,岐阜県岐阜市茜部辰新1-67-1,jageocoder
岐阜県岐阜市茜部大川二-4-1,35.38214874267578,136.7473602294922,岐阜県岐阜市茜部大川二-4-1,jageocoder
岡山県岡山市北区中井町2-5-35-4,34.68351364135742,133.93162536621094,岡山県岡山市北区中井町2-5-35-4,jageocoder
岡山県岡山市中区平井7-18-6,34.6347770690918,133.94993591308594,岡山県岡山市中区平井7-18-6,jageocoder
岡山県岡山市南区泉田376-2 Pモ-ル泉田内,34.625267028808594,133.91041564941406,岡山県岡山市南区泉田376-2 Pモ-ル泉田内,jageocoder
岡山県岡山市南区藤田字錦560-214 P-MALL藤田内,34.58957290649414,133.88619995117188,岡山県岡山市南区藤田字錦560-214 P-MALL藤田内,jageocoder
岡山県岡山市中区高屋336-1,34.67461013793945,133.9680633544922,岡山県岡山市中区高屋336-1,jageocoder
愛知県岡崎市井田西町3-9,34.97633361816406,137.1600341796875,愛知県岡崎市井田西町3-9,jageocoder
和歌山県岩出市中迫106-の1,34.2645378112793,135.3175506591797,和歌山県岩出市中迫106-の1,jageocoder
北海道岩見沢市大和1条8-5- 岩見沢大和タウンプラザ内,43.190093994140625,141.73606872558594,北海道岩見沢市大和1条8-5- 岩見沢大和タウンプラザ内,jageocoder
大阪府岸和田市港緑町3-1 WEST棟2F,34.46748352050781,135.3714599609375,大阪府岸和田市港緑町3-1 WEST棟2F,jageocoder
大阪府岸和田市春木若松町19-20,34.47907257080078,135.3908233642578,大阪府岸和田市春木若松町19-20,jageocoder
東京都東村山市久米川町1-36-1,35.76808547973633,139.48707580566406,東京都東村山市久米川町1-36-1,jageocoder
東京都町田市三輪町281-1,35.578678131103516,139.50021362304688,東京都町田市三輪町281-1,jageocoder
京都府京都市右京区嵯峨新宮町10-1,35.021339416503906,135.68679809570312,京都府京都市右京区嵯峨新宮町10-1,jageocoder
埼玉県川口市江戸1-8-38,35.82258224487305,139.75205993652344,埼玉県川口市江戸1-8-38,jageocoder
神奈川県川崎市川崎区日進町1-11 川崎ルフロン6F,35.5280647277832,139.69509887695312,神奈川県川崎市川崎区日進町1-11 川崎ルフロン6F,jageocoder
神奈川県川崎市川崎区下並木75-,35.52216720581055,139.68878173828125,神奈川県川崎市川崎区下並木75-,jageocoder
神奈川県川崎市中原区中丸子639-1,35.5648078918457,139.67442321777344,神奈川県川崎市中原区中丸子639-1,jageocoder
神奈川県川崎市高津区久末2144-1,35.56838607788086,139.6248321533203,神奈川県川崎市高津区久末2144-1,jageocoder
神奈川県川崎市高津区久地2-5-21,35.61212921142578,139.61216735839844,神奈川県川崎市高津区久地2-5-21,jageocoder
神奈川県川崎市多摩区長沢4-29-1,35.59912109375,139.5338897705078,神奈川県川崎市多摩区長沢4-29-1,jageocoder
神奈川県川崎市宮前区馬絹4-2-5,35.580692291259766,139.5970916748047,神奈川県川崎市宮前区馬絹4-2-5,jageocoder
神奈川県川崎市麻生区黒川字谷769-1,35.619022369384766,139.46841430664062,神奈川県川崎市麻生区黒川字谷769-1,jageocoder
兵庫県川西市矢問3-22-2,34.85800552368164,135.4066619873047,兵庫県川西市矢問3-22-2,jageocoder
埼玉県川越市南大塚3-10-16,35.89081573486328,139.46066284179688,埼玉県川越市南大塚3-10-16,jageocoder
埼玉県川越市小仙波町2-14-1,35.919654846191406,139.49444580078125,埼玉県川越市小仙波町2-14-1,jageocoder
千葉県市原市五所1702-,35.532596588134766,140.1101531982422,千葉県市原市五所1702-,jageocoder
千葉県市原市千種6-8-1,35.49244689941406,140.06150817871094,千葉県市原市千種6-8-1,jageocoder
大阪府東大阪市寿町1-11-2,34.652557373046875,135.56851196289062,大阪府東大阪市寿町1-11-2,jageocoder
北海道帯広市稲田町南8線西10-1 2F,42.89056396484375,143.19876098632812,北海道帯広市稲田町南8線西10-1 2F,jageocoder
北海道帯広市南の森西1-1-2,42.884368896484375,143.17408752441406,北海道帯広市南の森西1-1-2,jageocoder
北海道帯広市西23条南3-54-11,42.91644287109375,143.12936401367188,北海道帯広市西23条南3-54-11,jageocoder
茨城県常陸大宮市中富町979-1,36.54724884033203,140.40786743164062,茨城県常陸大宮市中富町979-1,jageocoder
神奈川県平塚市南原1-24-17,35.33835983276367,139.3234405517578,神奈川県平塚市南原1-24-17,jageocoder
大阪府大阪市平野区加美東4-15-8,34.630157470703125,135.56719970703125,大阪府大阪市平野区加美東4-15-8,jageocoder
大阪府大阪市平野区平野西6-1-9,34.61846923828125,135.5477294921875,大阪府大阪市平野区平野西6-1-9,jageocoder
広島県広島市西区井口明神1-16-1 広島アルパ-ク西棟 4F,34.3724365234375,132.3932342529297,広島県広島市西区井口明神1-16-1 広島アルパ-ク西棟 4F,jageocoder
広島県広島市佐伯区八幡東3-10-1,34.3884162902832,132.36460876464844,広島県広島市佐伯区八幡東3-10-1,jageocoder
広島県広島市安佐北区深川6-3-28,34.480812072753906,132.5336456298828,広島県広島市安佐北区深川6-3-28,jageocoder
広島県広島市安佐南区大町東2-12-16,34.46055603027344,132.4680938720703,広島県広島市安佐南区大町東2-12-16,jageocoder
広島県広島市南区段原南1-3-52 広島段原ショッピングセンタ-4F,34.38589859008789,132.47579956054688,広島県広島市南区段原南1-3-52 広島段原ショッピングセンタ-4F,jageocoder
広島県安芸郡海田町栄町5-8,34.36066818237305,132.53431701660156,広島県安芸郡海田町栄町5-8,jageocoder
広島県広島市安佐南区祇園6-15-6,34.44532775878906,132.4652557373047,広島県広島市安佐南区祇園6-15-6,jageocoder
兵庫県姫路市広畑区夢前町一-2-14,34.79597473144531,134.63856506347656,兵庫県姫路市広畑区夢前町一-2-14,jageocoder
兵庫県姫路市広畑区小松町2-76-,34.801109313964844,134.62318420410156,兵庫県姫路市広畑区小松町2-76-,jageocoder
東京都府中市四谷5-23-12 府中四谷ショッピングセンタ-2階,35.668418884277344,139.43800354003906,東京都府中市四谷5-23-12 府中四谷ショッピングセンタ-2階,jageocoder
宮崎県延岡市愛宕町3-4575-1,32.567169189453125,131.67103576660156,宮崎県延岡市愛宕町3-4575-1,jageocoder
広島県廿日市市宮内4-13-15,34.34991455078125,132.3131103515625,広島県廿日市市宮内4-13-15,jageocoder
青森県弘前市大字早稲田4-3-7,40.60049819946289,140.51393127441406,青森県弘前市大字早稲田4-3-7,jageocoder
青森県弘前市神田4-3-11,40.62582778930664,140.48854064941406,青森県弘前市神田4-3-11,jageocoder
和歌山県御坊市湯川町財部字深州46-4,33.90397644042969,135.15257263183594,和歌山県御坊市湯川町財部字深州46-4,jageocoder
山口県下松市大字末武中字鳥越1145-11,34.028831481933594,131.84417724609375,山口県下松市大字末武中字鳥越1145-11,jageocoder
徳島県徳島市南矢三町1-3-60,34.08585739135742,134.52835083007812,徳島県徳島市南矢三町1-3-60,jageocoder
徳島県徳島市新浜本町三-4-42,34.04384994506836,134.56625366210938,徳島県徳島市新浜本町三-4-42,jageocoder
徳島県徳島市末広1-5-48,34.06245803833008,134.56979370117188,徳島県徳島市末広1-5-48,jageocoder
徳島県板野郡藍住町奥野字東中須64-1,34.11710739135742,134.50279235839844,徳島県板野郡藍住町奥野字東中須64-1,jageocoder
三重県志摩市阿児町鵜方字小向井4939 プラザ21ショッピングセンタ-内,34.32654571533203,136.81307983398438,三重県志摩市阿児町鵜方字小向井4939 プラザ21ショッピングセンタ-内,jageocoder
北海道恵庭市黄金南6-10-5,42.89109420776367,141.59866333007812,北海道恵庭市黄金南6-10-5,jageocoder
千葉県成田市ウイング土屋165,35.79414367675781,140.32321166992188,千葉県成田市ウイング土屋165,jageocoder
大阪府大阪市住吉区我孫子東2-7-10第2グランド-ル住吉,34.59870147705078,135.51254272460938,大阪府大阪市住吉区我孫子東2-7-10第2グランド-ル住吉,jageocoder
神奈川県横浜市戸塚区戸塚町1306-10,35.380001068115234,139.52586364746094,神奈川県横浜市戸塚区戸塚町1306-10,jageocoder
埼玉県戸田市氷川町1-5-14,35.808406829833984,139.6612091064453,埼玉県戸田市氷川町1-5-14,jageocoder
鹿児島県指宿市西方1960-1,31.258554458618164,130.63174438476562,鹿児島県指宿市西方1960-1,jageocoder
大阪府摂津市東正雀19-61,34.78289031982422,135.55479431152344,大阪府摂津市東正雀19-61,jageocoder
福井県敦賀市新松島町13-5,35.64603805541992,136.05459594726562,福井県敦賀市新松島町13-5,jageocoder
兵庫県たつの市龍野町小宅北字前田41-11,34.85530471801758,134.5568084716797,兵庫県たつの市龍野町小宅北字前田41-11,jageocoder
兵庫県姫路市紺屋町57,34.83063888549805,134.69216918945312,兵庫県姫路市紺屋町57,jageocoder
佐賀県武雄市武雄町大字富岡12506-4 アクロスプラザ武雄内,33.1980094909668,130.03314208984375,佐賀県武雄市武雄町大字富岡12506-4 アクロスプラザ武雄内,jageocoder
滋賀県栗東市綣2-3-22,35.0369987487793,135.9810791015625,滋賀県栗東市綣2-3-22,jageocoder
愛知県弥富市五明町蒲原1371-4,35.1146354675293,136.7159423828125,愛知県弥富市五明町蒲原1371-4,jageocoder
埼玉県さいたま市南区別所7-3-1 オリンピック武蔵浦和B1F,35.84736251831055,139.6475067138672,埼玉県さいたま市南区別所7-3-1 オリンピック武蔵浦和B1F,jageocoder
滋賀県守山市今浜町2620-5 ピエリ守山2階,35.12283706665039,135.9456787109375,滋賀県守山市今浜町2620-5 ピエリ守山2階,jageocoder
鹿児島県鹿児島市与次郎1-11-1 ジャングルパ-ク内2階,31.57126235961914,130.5642547607422,鹿児島県鹿児島市与次郎1-11-1 ジャングルパ-ク内2階,jageocoder
山口県下関市伊倉新町1-4-43,34.006473541259766,130.93936157226562,山口県下関市伊倉新町1-4-43,jageocoder
長野県佐久市岩村田1442-1,36.27269744873047,138.46324157714844,長野県佐久市岩村田1442-1,jageocoder
岡山県倉敷市北畝5-19-16,34.54010772705078,133.7535400390625,岡山県倉敷市北畝5-19-16,jageocoder
高知県四万十市具同字八反田3193-1,32.97925567626953,132.91436767578125,高知県四万十市具同字八反田3193-1,jageocoder
埼玉県春日部市粕壁東3-9-11,35.9788703918457,139.76119995117188,埼玉県春日部市粕壁東3-9-11,jageocoder
岐阜県大垣市中野町2-1-7,35.38202667236328,136.60633850097656,岐阜県大垣市中野町2-1-7,jageocoder
京都府宇治市槇島町二十四57-3,34.9121208190918,135.78294372558594,京都府宇治市槇島町二十四57-3,jageocoder
福岡県北九州市小倉北区井堀3-18-12,33.882537841796875,130.8453369140625,福岡県北九州市小倉北区井堀3-18-12,jageocoder
兵庫県宍粟市山崎町鶴木8-2,34.995361328125,134.54074096679688,兵庫県宍粟市山崎町鶴木8-2,jageocoder
埼玉県新座市片山1-20-36,35.770118713378906,139.56387329101562,埼玉県新座市片山1-20-36,jageocoder
宮崎県日南市吾田西4-5-33,31.613197326660156,131.37002563476562,宮崎県日南市吾田西4-5-33,jageocoder
新潟県新潟市江南区早苗2-1-43,37.87126922607422,139.0929718017578,新潟県新潟市江南区早苗2-1-43,jageocoder
新潟県新潟市西区寺尾台3-1-8,37.88196563720703,138.975341796875,新潟県新潟市西区寺尾台3-1-8,jageocoder
新潟県新潟市中央区新和1-2-20,37.90291976928711,139.04246520996094,新潟県新潟市中央区新和1-2-20,jageocoder
新潟県新潟市東区河渡新町2-3-29,37.94725036621094,139.10958862304688,新潟県新潟市東区河渡新町2-3-29,jageocoder
新潟県新潟市南区神屋218-1,37.77298355102539,139.01837158203125,新潟県新潟市南区神屋218-1,jageocoder
新潟県新潟市東区竹尾3-13-6,37.91452407836914,139.09642028808594,新潟県新潟市東区竹尾3-13-6,jageocoder
新潟県新発田市小舟町一-1-32 新発田ミッドタウン小舟SC内,37.963809967041016,139.3274383544922,新潟県新発田市小舟町一-1-32 新発田ミッドタウン小舟SC内,jageocoder
新潟県新発田市舟入町2-4-21,37.956634521484375,139.30850219726562,新潟県新発田市舟入町2-4-21,jageocoder
兵庫県神崎郡福崎町南田原2255-1,34.943668365478516,134.75718688964844,兵庫県神崎郡福崎町南田原2255-1,jageocoder
岩手県花巻市桜台二-9-9,39.39749526977539,141.1024169921875,岩手県花巻市桜台二-9-9,jageocoder
東京都杉並区上荻1-9-1 荻窪タウンセブン2階,35.705223083496094,139.61981201171875,東京都杉並区上荻1-9-1 荻窪タウンセブン2階,jageocoder
奈良県香芝市上中255-1,34.55868911743164,135.6998748779297,奈良県香芝市上中255-1,jageocoder
鹿児島県出水市中央町1544,32.08016586303711,130.34262084960938,鹿児島県出水市中央町1544,jageocoder
宮崎県日向市都町14-10,32.42720031738281,131.62664794921875,宮崎県日向市都町14-10,jageocoder
兵庫県川辺郡猪名川町松尾台1-2-1 日生中央サピエ 2階,34.90674591064453,135.39181518554688,兵庫県川辺郡猪名川町松尾台1-2-1 日生中央サピエ 2階,jageocoder
茨城県日立市金沢町1-12-14,36.54078674316406,140.62319946289062,茨城県日立市金沢町1-12-14,jageocoder
愛知県日進市竹の山三-807-,35.15281677246094,137.03843688964844,愛知県日進市竹の山三-807-,jageocoder
東京都日野市大字上田50-,35.66891860961914,139.4063720703125,東京都日野市大字上田50-,jageocoder
北海道旭川市旭神2条2-5-21,43.73859786987305,142.38360595703125,北海道旭川市旭神2条2-5-21,jageocoder
北海道旭川市東光8条1-3-4,43.74867630004883,142.38853454589844,北海道旭川市東光8条1-3-4,jageocoder
北海道旭川市永山二条4-1-20,43.79022979736328,142.4012451171875,北海道旭川市永山二条4-1-20,jageocoder
北海道旭川市緑町12-1125-92,43.783912658691406,142.33786010742188,北海道旭川市緑町12-1125-92,jageocoder
千葉県旭市ニ6011-1,35.72360610961914,140.619873046875,千葉県旭市ニ6011-1,jageocoder
兵庫県明石市魚住町中尾508-,34.6905403137207,134.90806579589844,兵庫県明石市魚住町中尾508-,jageocoder
三重県桑名市星川785- 星川サンシティ2F,35.067962646484375,136.62684631347656,三重県桑名市星川785- 星川サンシティ2F,jageocoder
福岡県春日市星見ヶ丘5-250-1,33.50620651245117,130.45083618164062,福岡県春日市星見ヶ丘5-250-1,jageocoder
愛知県春日井市八田町八-1-7,35.25169372558594,136.9718780517578,愛知県春日井市八田町八-1-7,jageocoder
福岡県春日市惣利1-25-,33.514434814453125,130.4694061279297,福岡県春日市惣利1-25-,jageocoder
兵庫県神戸市中央区北本町通1-1-29,34.6990966796875,135.2086181640625,兵庫県神戸市中央区北本町通1-1-29,jageocoder
東京都昭島市緑町4-3-25,35.71519470214844,139.34619140625,東京都昭島市緑町4-3-25,jageocoder
東京都江東区有明2-1-8,35.637699127197266,139.7904510498047,東京都江東区有明2-1-8,jageocoder
愛知県名古屋市緑区南陵601,35.0451545715332,136.96580505371094,愛知県名古屋市緑区南陵601,jageocoder
埼玉県朝霞市幸町2-4-12,35.790321350097656,139.58799743652344,埼玉県朝霞市幸町2-4-12,jageocoder
千葉県木更津市ほたる野2-22-4,35.38092041015625,139.9654541015625,千葉県木更津市ほたる野2-22-4,jageocoder
千葉県木更津市請西1-10-30,35.37595748901367,139.9350128173828,千葉県木更津市請西1-10-30,jageocoder
千葉県木更津市金田東6-3-8,35.43406295776367,139.93209838867188,千葉県木更津市金田東6-3-8,jageocoder
埼玉県本庄市早稲田の杜4-1-3,36.22185134887695,139.1842803955078,埼玉県本庄市早稲田の杜4-1-3,jageocoder
熊本県天草市丸尾町15-27,32.46989822387695,130.1857147216797,熊本県天草市丸尾町15-27,jageocoder
北海道札幌市中央区北十条西23-2-1,43.06847381591797,141.31942749023438,北海道札幌市中央区北十条西23-2-1,jageocoder
北海道札幌市北区屯田8条7-10-27,43.14154052734375,141.33169555664062,北海道札幌市北区屯田8条7-10-27,jageocoder
北海道札幌市清田区北野3条1-12-15,43.01423263549805,141.42886352539062,北海道札幌市清田区北野3条1-12-15,jageocoder
北海道札幌市北区新琴似1条13-16-25,43.11410140991211,141.3059539794922,北海道札幌市北区新琴似1条13-16-25,jageocoder
北海道札幌市東区北三十条東十九-2-15,43.101951599121094,141.3775177001953,北海道札幌市東区北三十条東十九-2-15,jageocoder
北海道札幌市東区東雁来9条4-7-14,43.09430694580078,141.4305419921875,北海道札幌市東区東雁来9条4-7-14,jageocoder
北海道札幌市西区発寒九条十四-516-411,43.1016960144043,141.27206420898438,北海道札幌市西区発寒九条十四-516-411,jageocoder
北海道札幌市白石区菊水8条4-2-15,43.05756759643555,141.3855743408203,北海道札幌市白石区菊水8条4-2-15,jageocoder
北海道札幌市豊平区西岡四条12-1-1,42.99784469604492,141.38026428222656,北海道札幌市豊平区西岡四条12-1-1,jageocoder
東京都杉並区今川1-19-15,35.71907043457031,139.6137237548828,東京都杉並区今川1-19-15,jageocoder
新潟県村上市上助渕1010-,38.20753479003906,139.48095703125,新潟県村上市上助渕1010-,jageocoder
山形県東根市温泉町三-14-6,38.467559814453125,140.38771057128906,山形県東根市温泉町三-14-6,jageocoder
大阪府大阪市東住吉区杭全2-12-10,34.636444091796875,135.53700256347656,大阪府大阪市東住吉区杭全2-12-10,jageocoder
東京都東久留米市南町3-7-3,35.74228286743164,139.5232391357422,東京都東久留米市南町3-7-3,jageocoder
東京都東大和市仲原1-8-3,35.74296188354492,139.44342041015625,東京都東大和市仲原1-8-3,jageocoder
大阪府東大阪市吉田本町二-2-25,34.6730842590332,135.6251220703125,大阪府東大阪市吉田本町二-2-25,jageocoder
広島県東広島市西条中央5-10-26,34.41162872314453,132.741943359375,広島県東広島市西条中央5-10-26,jageocoder
神奈川県横浜市戸塚区川上町87-8 東戸塚西口プラザ 2F,35.431644439697266,139.5543670654297,神奈川県横浜市戸塚区川上町87-8 東戸塚西口プラザ 2F,jageocoder
埼玉県所沢市東所沢和田3-5-7,35.79788589477539,139.51092529296875,埼玉県所沢市東所沢和田3-5-7,jageocoder
埼玉県東松山市あずま町二-8-2,36.004947662353516,139.4083251953125,埼玉県東松山市あずま町二-8-2,jageocoder
東京都板橋区前野町6-3-1,35.76371383666992,139.68495178222656,東京都板橋区前野町6-3-1,jageocoder
埼玉県さいたま市緑区大間木2-1-9,35.876670837402344,139.69415283203125,埼玉県さいたま市緑区大間木2-1-9,jageocoder
奈良県生駒市東菜畑1-291,34.68635177612305,135.71359252929688,奈良県生駒市東菜畑1-291,jageocoder
愛知県愛知郡東郷町大字春木字白土1-2200,35.10903549194336,137.02183532714844,愛知県愛知郡東郷町大字春木字白土1-2200,jageocoder
千葉県東金市田間三-39-1,35.56949234008789,140.37498474121094,千葉県東金市田間三-39-1,jageocoder
大阪府松原市東新町5-11-27,34.57487487792969,135.5426483154297,大阪府松原市東新町5-11-27,jageocoder
愛媛県松山市東垣生町160-1 3/12(木)をもちまして閉店致しました。 永らくのご愛顧、誠にありがとうございました。 -,33.812862396240234,132.71690368652344,愛媛県松山市東垣生町160-1 3/12(木)をもちまして閉店致しました。 永らくのご愛顧、誠にありがとうございました。 -,jageocoder
愛媛県松山市東石井6-2-6,33.80936050415039,132.77798461914062,愛媛県松山市東石井6-2-6,jageocoder
愛媛県松山市東垣生町964-1,33.81662368774414,132.71055603027344,愛媛県松山市東垣生町964-1,jageocoder
愛媛県松山市鷹子町495-1,33.81258773803711,132.81570434570312,愛媛県松山市鷹子町495-1,jageocoder
千葉県松戸市古ヶ崎二-3083-,35.798431396484375,139.89683532714844,千葉県松戸市古ヶ崎二-3083-,jageocoder
千葉県松戸市大橋393-1,35.76588439941406,139.9107208251953,千葉県松戸市大橋393-1,jageocoder
千葉県松戸市常盤平1-3-1,35.80295944213867,139.9461212158203,千葉県松戸市常盤平1-3-1,jageocoder
長野県松本市筑摩3-1-20,36.22185516357422,137.98046875,長野県松本市筑摩3-1-20,jageocoder
島根県松江市春日町字中代186-1,35.486541748046875,133.04595947265625,島根県松江市春日町字中代186-1,jageocoder
島根県松江市東津田町1132-1,35.45822525024414,133.08380126953125,島根県松江市東津田町1132-1,jageocoder
三重県松阪市塚本町15-,34.59354019165039,136.52127075195312,三重県松阪市塚本町15-,jageocoder
三重県松阪市大黒田町717,34.56251525878906,136.5283660888672,三重県松阪市大黒田町717,jageocoder
