address,lat,lng,raw_query,provider
東京都千代田区丸の内1-9-1,35.681607,139.767051,東京都千代田区丸の内1-9-1,nominatim
福岡県福岡市東区箱崎4-7-55 BOXタウン箱崎内(1階),33.61943435668945,130.4174041748047,福岡県福岡市東区箱崎4-7-55 BOXタウン箱崎内(1階),jageocoder
広島県広島市南区宇品海岸3-7-65 DCMダイキ宇品店内,34.35577392578125,132.46336364746094,広島県広島市南区宇品海岸3-7-65 DCMダイキ宇品店内,jageocoder
北海道河東郡音更町木野大通東12-2-12 DCM音更内,42.95949172973633,143.2078094482422,北海道河東郡音更町木野大通東12-2-12 DCM音更内,jageocoder
東京都荒川区南千住4-7-2 LaLaテラス南千住1F,35.7358283996582,139.8019256591797,東京都荒川区南千住4-7-2 LaLaテラス南千住1F,jageocoder
神奈川県平塚市代官町33-1 OSC湘南シティ2F 3/26(木)同施設内1Fに売場を拡大してリニュ-アルオ-プンします。,35.328758239746094,139.35679626464844,神奈川県平塚市代官町33-1 OSC湘南シティ2F 3/26(木)同施設内1Fに売場を拡大してリニュ-アルオ-プンします。,jageocoder
東京都あきる野市秋川1-17-1 あきるのプレイス2F,35.73088836669922,139.28729248046875,東京都あきる野市秋川1-17-1 あきるのプレイス2F,jageocoder
東京都あきる野市瀬戸岡781-3,35.7397346496582,139.2904815673828,東京都あきる野市瀬戸岡781-3,jageocoder
大分県大分市明野東一-1-1 あけのアクロスタウン本館内 4F,33.22404098510742,131.6527099609375,大分県大分市明野東一-1-1 あけのアクロスタウン本館内 4F,jageocoder
千葉県我孫子市我孫子4-11-1 あびこショッピングプラザ2階,35.8764762878418,140.00950622558594,千葉県我孫子市我孫子4-11-1 あびこショッピングプラザ2階,jageocoder
大阪府泉佐野市下瓦屋2-2-77 いこらも〜る泉佐野2F,34.421775817871094,135.3287811279297,大阪府泉佐野市下瓦屋2-2-77 いこらも〜る泉佐野2F,jageocoder
福島県いわき市平谷川瀬二-3-4,37.046783447265625,140.8939208984375,福島県いわき市平谷川瀬二-3-4,jageocoder
福島県いわき市東田町2-17-7,36.92124938964844,140.80218505859375,福島県いわき市東田町2-17-7,jageocoder
福島県いわき市鹿島町久保字反町11-6,36.988704681396484,140.90499877929688,福島県いわき市鹿島町久保字反町11-6,jageocoder
沖縄県うるま市安慶名3-2-14,26.37354850769043,127.852783203125,沖縄県うるま市安慶名3-2-14,jageocoder
大阪府大阪市東淀川区大隅1-6-12,34.7484130859375,135.54107666015625,大阪府大阪市東淀川区大隅1-6-12,jageocoder
埼玉県さいたま市見沼区大字東門前32-1,35.93103790283203,139.6664276123047,埼玉県さいたま市見沼区大字東門前32-1,jageocoder
山形県鶴岡市千石町3-39,38.71867370605469,139.82940673828125,山形県鶴岡市千石町3-39,jageocoder
神奈川県横浜市戸塚区戸塚町4253-1 サクラス戸塚2階,35.401123046875,139.53106689453125,神奈川県横浜市戸塚区戸塚町4253-1 サクラス戸塚2階,jageocoder
北海道札幌市中央区北2条東4-1-2 サッポロファクトリ-1条館1F,43.06517028808594,141.3618621826172,北海道札幌市中央区北2条東4-1-2 サッポロファクトリ-1条館1F,jageocoder
東京都多摩市東寺方660-1 サミット東寺方店2F,35.64144515991211,139.43557739257812,東京都多摩市東寺方660-1 サミット東寺方店2F,jageocoder
神奈川県横浜市西区岡野2-5-18 サミット横浜岡野店の1階,35.45915603637695,139.61154174804688,神奈川県横浜市西区岡野2-5-18 サミット横浜岡野店の1階,jageocoder
東京都世田谷区砧1-1-2 サミットストア砧店3F,35.63620376586914,139.62130737304688,東京都世田谷区砧1-1-2 サミットストア砧店3F,jageocoder
東京都杉並区高井戸東4-1-13,35.68653869628906,139.62245178222656,東京都杉並区高井戸東4-1-13,jageocoder
福岡県宗像市くりえいと一-5-1 サンリブくりえいと宗像内1F,33.812564849853516,130.56326293945312,福岡県宗像市くりえいと一-5-1 サンリブくりえいと宗像内1F,jageocoder
福岡県古賀市天神2-5-1 サンリブ古賀 2F,33.73451614379883,130.46624755859375,福岡県古賀市天神2-5-1 サンリブ古賀 2F,jageocoder
静岡県島田市阿知ヶ谷25-1,34.836708068847656,138.1969451904297,静岡県島田市阿知ヶ谷25-1,jageocoder
東京都多摩市関戸1-1-5ザ・スクエア1F(聖蹟桜ヶ丘駅西口より徒歩3分),35.651363372802734,139.44589233398438,東京都多摩市関戸1-1-5ザ・スクエア1F(聖蹟桜ヶ丘駅西口より徒歩3分),jageocoder
山口県萩市大字椿字田村2283-1,34.389774322509766,131.4057159423828,山口県萩市大字椿字田村2283-1,jageocoder
北海道札幌市豊平区豊平4条9-3-1,43.04767990112305,141.37535095214844,北海道札幌市豊平区豊平4条9-3-1,jageocoder
東京都八王子市並木町35-1,35.65553665161133,139.30397033691406,東京都八王子市並木町35-1,jageocoder
神奈川県相模原市中央区下九沢57-1,35.575782775878906,139.34632873535156,神奈川県相模原市中央区下九沢57-1,jageocoder
北海道稚内市新光町1483-76 シティわっかない内,45.38616180419922,141.70040893554688,北海道稚内市新光町1483-76 シティわっかない内,jageocoder
愛知県名古屋市昭和区白金3-6-24 シャンピアポ-ト高辻内2階ダイソ-横,35.143009185791016,136.91769409179688,愛知県名古屋市昭和区白金3-6-24 シャンピアポ-ト高辻内2階ダイソ-横,jageocoder
福岡県筑紫野市大字原田836-5,33.443443298339844,130.53915405273438,福岡県筑紫野市大字原田836-5,jageocoder
埼玉県さいたま市中央区本町東6-14-26,35.89424514770508,139.615234375,埼玉県さいたま市中央区本町東6-14-26,jageocoder
埼玉県さいたま市岩槻区南平野二-25-2,35.95634078979492,139.71685791015625,埼玉県さいたま市岩槻区南平野二-25-2,jageocoder
埼玉県さいたま市北区日進町3-443-1,35.93754577636719,139.60357666015625,埼玉県さいたま市北区日進町3-443-1,jageocoder
山形県東根市中央南1-5-22,38.427490234375,140.39320373535156,山形県東根市中央南1-5-22,jageocoder
大阪府河内長野市西之山町5-20 じゃんぼスクエア河内長野 1階,34.4559440612793,135.56304931640625,大阪府河内長野市西之山町5-20 じゃんぼスクエア河内長野 1階,jageocoder
神奈川県鎌倉市笛田町1-2-10 たまや鎌倉手広店2F,35.330020904541016,139.513916015625,神奈川県鎌倉市笛田町1-2-10 たまや鎌倉手広店2F,jageocoder
兵庫県尼崎市塚口本町4-8-1 ひがしまち南館3F,34.76158142089844,135.41793823242188,兵庫県尼崎市塚口本町4-8-1 ひがしまち南館3F,jageocoder
茨城県つくば市研究学園3-10-7,36.086395263671875,140.07440185546875,茨城県つくば市研究学園3-10-7,jageocoder
茨城県ひたちなか市中根字深谷津3328-2,36.396358489990234,140.55154418945312,茨城県ひたちなか市中根字深谷津3328-2,jageocoder
埼玉県ふじみ野市ふじみ野2-25-26,35.86309814453125,139.5177001953125,埼玉県ふじみ野市ふじみ野2-25-26,jageocoder
東京都町田市旭町1-24-1,35.554443359375,139.44227600097656,東京都町田市旭町1-24-1,jageocoder
長崎県長崎市茂里町1-55,32.76298141479492,129.86477661132812,長崎県長崎市茂里町1-55,jageocoder
青森県むつ市小川町一-104-1,41.29208755493164,141.20350646972656,青森県むつ市小川町一-104-1,jageocoder
大阪府大阪市中央区森ノ宮中央2-1-70 もりのみやキュ-ズモ-ル2F,34.68128204345703,135.53134155273438,大阪府大阪市中央区森ノ宮中央2-1-70 もりのみやキュ-ズモ-ル2F,jageocoder
広島県呉市宝町2-50 ゆめタウン呉レクレ館,34.24428939819336,132.5567169189453,広島県呉市宝町2-50 ゆめタウン呉レクレ館,jageocoder
広島県大竹市晴海1-6-1 ゆめタウン大竹2F,34.24143600463867,132.2238006591797,広島県大竹市晴海1-6-1 ゆめタウン大竹2F,jageocoder
大阪府泉佐野市りんくう往来南3- りんくうシ-クル内,34.40622329711914,135.29515075683594,大阪府泉佐野市りんくう往来南3- りんくうシ-クル内,jageocoder
大阪府阪南市下出167-の1 2F,34.36176300048828,135.24349975585938,大阪府阪南市下出167-の1 2F,jageocoder
東京都豊島区南長崎4-5-20,35.72391128540039,139.68301391601562,東京都豊島区南長崎4-5-20,jageocoder
山形県東田川郡三川町大字猪子字大堰端351-1 アクロスプラザ三川内,38.81830978393555,139.83432006835938,山形県東田川郡三川町大字猪子字大堰端351-1 アクロスプラザ三川内,jageocoder
青森県五所川原市唐笠柳藤巻641-1,40.80092239379883,140.46151733398438,青森県五所川原市唐笠柳藤巻641-1,jageocoder
福島県いわき市小名浜大原字東田81-1 アクロスプラザ大原内,36.967018127441406,140.8906707763672,福島県いわき市小名浜大原字東田81-1 アクロスプラザ大原内,jageocoder
秋田県大館市餌釣字前田1- アクロスプラザ大館南内,40.2494010925293,140.57745361328125,秋田県大館市餌釣字前田1- アクロスプラザ大館南内,jageocoder
福岡県北九州市小倉北区明和町1-8,33.877132415771484,130.88755798339844,福岡県北九州市小倉北区明和町1-8,jageocoder
岐阜県恵那市長島町正家3-8-64-1,35.4454460144043,137.4171905517578,岐阜県恵那市長島町正家3-8-64-1,jageocoder
愛知県丹羽郡扶桑町高雄下野7,35.36503219604492,136.9218292236328,愛知県丹羽郡扶桑町高雄下野7,jageocoder
北海道札幌市中央区南23条西7-1-5,43.02954864501953,141.35162353515625,北海道札幌市中央区南23条西7-1-5,jageocoder
北海道札幌市南区石山二条9-7-62 アクロスプラザ札幌南内,42.95985412597656,141.3132781982422,北海道札幌市南区石山二条9-7-62 アクロスプラザ札幌南内,jageocoder
神奈川県横浜市神奈川区西寺尾1-16-15,35.500877380371094,139.64439392089844,神奈川県横浜市神奈川区西寺尾1-16-15,jageocoder
岩手県紫波郡紫波町日詰字丸盛197-1 アクロスプラザ紫波SC内,39.557861328125,141.16116333007812,岩手県紫波郡紫波町日詰字丸盛197-1 アクロスプラザ紫波SC内,jageocoder
兵庫県西脇市高田井町55-1,34.985713958740234,134.96450805664062,兵庫県西脇市高田井町55-1,jageocoder
長崎県諫早市久山町1271-6 アクロスプラザ諫早内,32.8278694152832,129.99819946289062,長崎県諫早市久山町1271-6 アクロスプラザ諫早内,jageocoder
滋賀県野洲市市三宅929- アクロスプラザ野洲内,35.068443298339844,136.01766967773438,滋賀県野洲市市三宅929- アクロスプラザ野洲内,jageocoder
新潟県長岡市沖田1-88- アクロスプラザ長岡内,37.44365310668945,138.86724853515625,新潟県長岡市沖田1-88- アクロスプラザ長岡内,jageocoder
栃木県足利市大月町3-2 アシコタウンあしかが内,36.33679962158203,139.477294921875,栃木県足利市大月町3-2 アシコタウンあしかが内,jageocoder
兵庫県明石市東仲ノ町6-1 アスピア明石南館3階,34.64809036254883,134.9950714111328,兵庫県明石市東仲ノ町6-1 アスピア明石南館3階,jageocoder
神奈川県厚木市戸室5-31-1 アツギトレリス1F,35.448646545410156,139.3433380126953,神奈川県厚木市戸室5-31-1 アツギトレリス1F,jageocoder
石川県加賀市作見町ル25-1 アビオシティ加賀 2F,36.32006072998047,136.35302734375,石川県加賀市作見町ル25-1 アビオシティ加賀 2F,jageocoder
神奈川県横浜市港北区綱島東4-3-17 アピタテラス横浜綱島2階,35.54195022583008,139.6414337158203,神奈川県横浜市港北区綱島東4-3-17 アピタテラス横浜綱島2階,jageocoder
愛知県一宮市木曽川町黒田八ノ通51-4,35.34449005126953,136.79042053222656,愛知県一宮市木曽川町黒田八ノ通51-4,jageocoder
石川県金沢市中村町10-20 アピタ金沢店 2階,36.5589485168457,136.64268493652344,石川県金沢市中村町10-20 アピタ金沢店 2階,jageocoder
愛知県長久手市戸田谷901-1 アピタ長久手店内,35.172454833984375,137.03834533691406,愛知県長久手市戸田谷901-1 アピタ長久手店内,jageocoder
宮城県白石市大平森合字森合沖83 アムザショッピングタウン白石内,37.996543884277344,140.61129760742188,宮城県白石市大平森合字森合沖83 アムザショッピングタウン白石内,jageocoder
滋賀県甲賀市水口町水口5555-,34.964115142822266,136.17140197753906,滋賀県甲賀市水口町水口5555-,jageocoder
岡山県真庭市久世2415- マルイ アルティ店内,35.080223083496094,133.74429321289062,岡山県真庭市久世2415- マルイ アルティ店内,jageocoder
京都府木津川市相楽城西15 アルプラザ木津2F,34.73853302001953,135.79249572753906,京都府木津川市相楽城西15 アルプラザ木津2F,jageocoder
兵庫県尼崎市潮江1-3-1 アル・プラザあまがさきキュ-ズモ-ル 3階,34.73311233520508,135.4317626953125,兵庫県尼崎市潮江1-3-1 アル・プラザあまがさきキュ-ズモ-ル 3階,jageocoder
大阪府茨木市上郡2-12-8 アル・プラザ茨木3階,34.838287353515625,135.5558319091797,大阪府茨木市上郡2-12-8 アル・プラザ茨木3階,jageocoder
愛知県安城市住吉町3-5-28 アンディ安城店2階,34.98019027709961,137.08221435546875,愛知県安城市住吉町3-5-28 アンディ安城店2階,jageocoder
熊本県菊池郡菊陽町大字津久礼2740-4,32.86454391479492,130.81214904785156,熊本県菊池郡菊陽町大字津久礼2740-4,jageocoder
北海道札幌市手稲区明日風6-1-1,43.14162826538086,141.23394775390625,北海道札幌市手稲区明日風6-1-1,jageocoder
埼玉県児玉郡上里町金久保359-1 イオンタウン上里2F,36.2603759765625,139.138671875,埼玉県児玉郡上里町金久保359-1 イオンタウン上里2F,jageocoder
岩手県北上市里分4地割77 イオンタウン北上内,39.29478073120117,141.13548278808594,岩手県北上市里分4地割77 イオンタウン北上内,jageocoder
愛知県名古屋市西区香呑町6-49-1,35.20404052734375,136.89248657226562,愛知県名古屋市西区香呑町6-49-1,jageocoder
山口県周南市古市1-4-1,34.0693244934082,131.75985717773438,山口県周南市古市1-4-1,jageocoder
福島県喜多方市塩川町小府根字曽谷田1 イオンタウン塩川内,37.61709976196289,139.89364624023438,福島県喜多方市塩川町小府根字曽谷田1 イオンタウン塩川内,jageocoder
岐阜県大垣市三塚町丹瀬463-1 イオンタウン大垣EAST 2F,35.365882873535156,136.6295623779297,岐阜県大垣市三塚町丹瀬463-1 イオンタウン大垣EAST 2F,jageocoder
静岡県富士市鮫島118-10 イオンタウン富士南1F,35.13909912109375,138.67715454101562,静岡県富士市鮫島118-10 イオンタウン富士南1F,jageocoder
山梨県中央市下河東3053-1,35.608497619628906,138.54161071777344,山梨県中央市下河東3053-1,jageocoder
青森県平川市小和森上松岡193-1 イオンタウン平賀内,40.59075164794922,140.56549072265625,青森県平川市小和森上松岡193-1 イオンタウン平賀内,jageocoder
滋賀県彦根市里根町24 イオンタウン彦根内,35.27032470703125,136.26673889160156,滋賀県彦根市里根町24 イオンタウン彦根内,jageocoder
大阪府松原市新堂4-1154 イオンタウン松原 2階,34.566192626953125,135.55223083496094,大阪府松原市新堂4-1154 イオンタウン松原 2階,jageocoder
宮城県柴田郡柴田町大字上名生字新大原194-1 イオンタウン柴田SC内,38.061893463134766,140.7954559326172,宮城県柴田郡柴田町大字上名生字新大原194-1 イオンタウン柴田SC内,jageocoder
茨城県東茨城郡茨城町長岡3480 イオンタウン水戸南内,36.309364318847656,140.43980407714844,茨城県東茨城郡茨城町長岡3480 イオンタウン水戸南内,jageocoder
沖縄県沖縄市泡瀬4-5-7 イオンタウン泡瀬内の1階,26.32179832458496,127.83039093017578,沖縄県沖縄市泡瀬4-5-7 イオンタウン泡瀬内の1階,jageocoder
三重県津市河芸町中別保丸垣内100-,34.78767395019531,136.54469299316406,三重県津市河芸町中別保丸垣内100-,jageocoder
静岡県御前崎市池新田5832-1 イオンタウン浜岡内,34.63724136352539,138.13462829589844,静岡県御前崎市池新田5832-1 イオンタウン浜岡内,jageocoder
埼玉県蕨市塚越5-6-35,35.822879791259766,139.7027587890625,埼玉県蕨市塚越5-6-35,jageocoder
香川県観音寺市昭和町1-3-18 イオンタウン観音寺SC内,34.12273025512695,133.65733337402344,香川県観音寺市昭和町1-3-18 イオンタウン観音寺SC内,jageocoder
沖縄県中頭郡読谷村字上地205-1,26.403911590576172,127.73604583740234,沖縄県中頭郡読谷村字上地205-1,jageocoder
栃木県那須塩原市島方455 イオンタウン那須塩原店内,36.93059539794922,140.00645446777344,栃木県那須塩原市島方455 イオンタウン那須塩原店内,jageocoder
岩手県釜石市港町2-1-1 イオンタウン釜石3F,39.272621154785156,141.88624572753906,岩手県釜石市港町2-1-1 イオンタウン釜石3F,jageocoder
青森県青森市浜田字玉川196-11,40.79904556274414,140.75953674316406,青森県青森市浜田字玉川196-11,jageocoder
福島県須賀川市仲の町105 イオンタウン須賀川内,37.297325134277344,140.38450622558594,福島県須賀川市仲の町105 イオンタウン須賀川内,jageocoder
千葉県館山市八幡545-1 イオンタウン館山内,35.006263732910156,139.86297607421875,千葉県館山市八幡545-1 イオンタウン館山内,jageocoder
秋田県北秋田市栄字中綱20-,40.22949981689453,140.38351440429688,秋田県北秋田市栄字中綱20-,jageocoder
青森県つがる市柏稲盛幾世41 イオンモ-ルつがる柏内1F専門店街,40.802757263183594,140.41641235351562,青森県つがる市柏稲盛幾世41 イオンモ-ルつがる柏内1F専門店街,jageocoder
大分県中津市三光佐知1032 イオンモ-ル三光 1階,33.557437896728516,131.195068359375,大分県中津市三光佐知1032 イオンモ-ル三光 1階,jageocoder
青森県上北郡おいらせ町中野平40-1,40.60478210449219,141.4178009033203,青森県上北郡おいらせ町中野平40-1,jageocoder
岐阜県土岐市土岐津町土岐口1372-1 イオンモ-ル土岐 2階,35.3484992980957,137.15383911132812,岐阜県土岐市土岐津町土岐口1372-1 イオンモ-ル土岐 2階,jageocoder
千葉県富津市青木1-5-1,35.33016586303711,139.84765625,千葉県富津市青木1-5-1,jageocoder
奈良県橿原市曲川町7-20-1,34.50555419921875,135.76483154296875,奈良県橿原市曲川町7-20-1,jageocoder
福岡県北九州市戸畑区汐井町2-2,33.89429473876953,130.81878662109375,福岡県北九州市戸畑区汐井町2-2,jageocoder
宮崎県日向市大字日知屋字古田町61-1 イオン日向店2F,32.424495697021484,131.65151977539062,宮崎県日向市大字日知屋字古田町61-1 イオン日向店2F,jageocoder
長崎県長崎市田中町1027-8,32.76961135864258,129.94725036621094,長崎県長崎市田中町1027-8,jageocoder
東京都武蔵村山市伊奈平3-36-1,35.73599624633789,139.37890625,東京都武蔵村山市伊奈平3-36-1,jageocoder
神奈川県海老名市中央3-2-5 2F,35.450538635253906,139.39111328125,神奈川県海老名市中央3-2-5 2F,jageocoder
鳥取県米子市末広町311 米子駅前ショッピングセンタ-3F,35.422794342041016,133.33306884765625,鳥取県米子市末広町311 米子駅前ショッピングセンタ-3F,jageocoder
福岡県北九州市若松区二島1-3-1,33.8913688659668,130.74172973632812,福岡県北九州市若松区二島1-3-1,jageocoder
東京都板橋区蓮根3-8-12 イオン西台店食品館 2階,35.785865783691406,139.67489624023438,東京都板橋区蓮根3-8-12 イオン西台店食品館 2階,jageocoder
宮崎県都城市早鈴町1990-,31.71526527404785,131.07574462890625,宮崎県都城市早鈴町1990-,jageocoder
千葉県千葉市若葉区千城台北3-21-1 イコアス千城台3階,35.62266540527344,140.18917846679688,千葉県千葉市若葉区千城台北3-21-1 イコアス千城台3階,jageocoder
兵庫県神戸市西区森友3-7-3 イズミヤSC神戸玉津 2F,34.66404724121094,134.98313903808594,兵庫県神戸市西区森友3-7-3 イズミヤSC神戸玉津 2F,jageocoder
京都府八幡市八幡一ノ坪23-1,34.86018753051758,135.71205139160156,京都府八幡市八幡一ノ坪23-1,jageocoder
京都府京都市伏見区桃山町西尾12-1 イズミヤ六地蔵店の2階,34.93488311767578,135.79299926757812,京都府京都市伏見区桃山町西尾12-1 イズミヤ六地蔵店の2階,jageocoder
大阪府吹田市山田南1-1 イズミヤ千里丘店別館2階,34.788814544677734,135.53872680664062,大阪府吹田市山田南1-1 イズミヤ千里丘店別館2階,jageocoder
東京都八王子市東浅川町550-1 イ-アス高尾内,35.64353942871094,139.2896270751953,東京都八王子市東浅川町550-1 イ-アス高尾内,jageocoder
愛知県岡崎市羽根町小豆坂3,34.92363739013672,137.17454528808594,愛知県岡崎市羽根町小豆坂3,jageocoder
山形県鶴岡市美咲町3-15,38.73292541503906,139.7994842529297,山形県鶴岡市美咲町3-15,jageocoder
栃木県那須塩原市鍋掛字鍋掛原1087-24 エイトタウン那須塩原内,36.96251678466797,140.06475830078125,栃木県那須塩原市鍋掛字鍋掛原1087-24 エイトタウン那須塩原内,jageocoder
大阪府大阪市城東区蒲生1-9-10 エディオン京橋店3階,34.6992301940918,135.5366973876953,大阪府大阪市城東区蒲生1-9-10 エディオン京橋店3階,jageocoder
大阪府門真市舟田町24-1 エディオン門真2階,34.73585891723633,135.60301208496094,大阪府門真市舟田町24-1 エディオン門真2階,jageocoder
香川県高松市春日町字川尻1028-の1 エディオン高松春日店内,34.32895278930664,134.09188842773438,香川県高松市春日町字川尻1028-の1 エディオン高松春日店内,jageocoder
大阪府高槻市緑町22-8,34.856285095214844,135.64102172851562,大阪府高槻市緑町22-8,jageocoder
熊本県水俣市大黒町2-3-18 エムズシティ1階,32.21050262451172,130.40164184570312,熊本県水俣市大黒町2-3-18 エムズシティ1階,jageocoder
埼玉県幸手市上高野764- エムズタウン内,36.0679817199707,139.7150421142578,埼玉県幸手市上高野764- エムズタウン内,jageocoder
長野県安曇野市三郷温2716-1 エルサあづみ野2階,36.24565124511719,137.88880920410156,長野県安曇野市三郷温2716-1 エルサあづみ野2階,jageocoder
茨城県神栖市大野原4-8-71-2,35.90044021606445,140.63706970214844,茨城県神栖市大野原4-8-71-2,jageocoder
神奈川県横浜市西区みなとみらい6-3-6 オ-ケ-みなとみらい店1F,35.46323776245117,139.63119506835938,神奈川県横浜市西区みなとみらい6-3-6 オ-ケ-みなとみらい店1F,jageocoder
神奈川県藤沢市南藤沢6-23 オ-ケ-藤沢店6F,35.33796691894531,139.49046325683594,神奈川県藤沢市南藤沢6-23 オ-ケ-藤沢店6F,jageocoder
茨城県つくば市小野崎278-1 カインズつくば店内,36.073265075683594,140.10345458984375,茨城県つくば市小野崎278-1 カインズつくば店内,jageocoder
和歌山県和歌山市川辺220 カインズ紀伊川辺内,34.261253356933594,135.26370239257812,和歌山県和歌山市川辺220 カインズ紀伊川辺内,jageocoder
群馬県前橋市小屋原町472-1 ガ-デン前橋内1階,36.356048583984375,139.12904357910156,群馬県前橋市小屋原町472-1 ガ-デン前橋内1階,jageocoder
青森県青森市三好二-1-9 ガ-ラタウン内,40.83238220214844,140.70460510253906,青森県青森市三好二-1-9 ガ-ラタウン内,jageocoder
千葉県松戸市松戸1307-1 キテミテマツド 3F,35.782318115234375,139.89892578125,千葉県松戸市松戸1307-1 キテミテマツド 3F,jageocoder
東京都調布市菊野台1-33-3 キテラタウン調布2F,35.657657623291016,139.56814575195312,東京都調布市菊野台1-33-3 キテラタウン調布2F,jageocoder
愛知県知立市長篠町大山18-1 ギャラリエアピタ知立 本館1F,34.99787521362305,137.05165100097656,愛知県知立市長篠町大山18-1 ギャラリエアピタ知立 本館1F,jageocoder
東京都多摩市永山1-4-,35.62924575805664,139.44813537597656,東京都多摩市永山1-4-,jageocoder
兵庫県芦屋市高浜町6-1 グルメシティ芦屋浜 3F,34.71940612792969,135.31622314453125,兵庫県芦屋市高浜町6-1 グルメシティ芦屋浜 3F,jageocoder
大分県佐伯市鶴岡西町2-176,32.959716796875,131.8666229248047,大分県佐伯市鶴岡西町2-176,jageocoder
千葉県流山市おおたかの森西1-15-3 コトエ流山おおたかの森 1階,35.87240982055664,139.92129516601562,千葉県流山市おおたかの森西1-15-3 コトエ流山おおたかの森 1階,jageocoder
岡山県倉敷市白楽町473 ス-パ-棟2F,34.58809280395508,133.77210998535156,岡山県倉敷市白楽町473 ス-パ-棟2F,jageocoder
岡山県笠岡市富岡114-4 コムプラザ笠岡内,34.49934005737305,133.52838134765625,岡山県笠岡市富岡114-4 コムプラザ笠岡内,jageocoder
大阪府和泉市室堂町824-36 COMBOX光明池内,34.46845626831055,135.47401428222656,大阪府和泉市室堂町824-36 COMBOX光明池内,jageocoder
